,ID,Author,Time,Comment,Score
1251,l3uy3do,Wickedweed,1715612629.0,"True for me too, although the same is true for most of the grocery stores near me. Unfortunately Whole Foods is the only one with consistently good produce",2
1252,l3vwkwv,old-world-reds,1715624577.0,"That's so disappointing. They just introduced a 3 pack of brussel sprouts, green beans, and asparagus by me. It's 3 separate packs the size for a family dinner for 3 or 4 people. They usually last 2, sometimes 3 weeks in our fridge with no special preparation.",1
1253,l3vll4v,Extinction-Entity,1715620824.0,"See, our Costco has moldy fruit for sale but our Kroger has incredible produce. I don’t get it.",2
1254,l3vmha4,HernandezGirl,1715621131.0,How about Sam’s Club. Are the fruits okay where you live?,1
1255,l3um37l,MoPacIsAPerfectLoop,1715608183.0,"I’ve had better luck with the bags of Envy’s than the Fujis and other varieties they have right now. Granted there have definitely been a few bad ones, but yeah I agree, there are some real bad ones sometimes.",4
1256,l3uu2w9,way2gimpy,1715611181.0,"I’ve found Costco produce to be terrible and spoils quickly.  I’ve also found that the produce in every supermarket I’ve been to in DC to be consistently terrible as well (except whole foods and Trader Joe’s).  When you put that together, I would just avoid it all.  

Props to you for dealing with exiting that parking lot.",5
1257,l3vty6p,psilvyy19,1715623680.0,"Yes!! Their grapes are the best! We get bananas, grapes, blueberries, apples, and avocados there",1
1258,l3vnhl8,xAlice_Liddell,1715621475.0,Yup. Green to brown in 24 hours.,2
1259,l3vn8ex,HernandezGirl,1715621389.0,Yeah the cantaloupes suck in general all over. They taste like they’re growing in recycled dish water,1
1260,l3vua2e,loucap81,1715623792.0,"I’ve had the opposite experience. Last few times the raspberries and blackberries have been flavorless and the regular supermarket has had much better quality.

That said I’ll still take my chances when they have the $2.99 raspberry sale.",1
1261,l3v8psp,reidybobeidy89,1715616376.0,Our apples are moving from the flat crate packing to bags now.,1
1262,l3vum4l,dconc_throwaway,1715623907.0,"Thanks for the suggestion, but I'd rather just buy them already frozen at that point (not that I really have the freezer space anyway).",1
1263,l3vbrm3,Aspen9999,1715617435.0,HEB always has great produce but I haven’t had any trouble with Costco either,2
1264,l3vo4p8,mmmmmarty,1715621692.0,"Same here. Rotting on the shelf at Costco, perfect at bottom-barrel Food Lion.",2
1265,l3vt09f,Polishrifle,1715623356.0,"Probably depends who costco is buying from as well.  I notice that all the markets use similar, but not all the same suppliers for fruits.

For instance, Costco uses wish farms for berries here and Publix uses Driscolls.  But sometimes costco will have Driscoll.  

Also there is crazy variance in pricing too on a week to week, dare I say shipment to shipment level.  I’ve seen Pineapple at $1.99 one week, to $2.59 the following, back to $1.99 the following week.  And the $2.59 crop was abysmal.  

I will say that I live in FL and go out of my way to get produce at Costco.  It’s $4 for a massive bag of organic carrots and it’s double that price at Publix for not even half the quantity.",1
1266,l3uxd1m,SenseiRaheem,1715612365.0,"Yeah, that parking lot is CRAZY. I don't know how recently they started doing it, but this past weekend the DC location had a crew of 6 or 7 people in bright vests directing traffic to get people out of that lot.",1
1267,l3vu7vu,Breakfastchocolate,1715623771.0,I don’t have food lion near home but I LOVE them!  The store baked coconut pecan cookies…mm,2
1268,l3v1xdp,kneeonball,1715613997.0,"My favorite is always the big line around the lot to get out that would take too long, so people would cut across the parking lot to then cut in line and make it take longer for everyone. That area is not meant to handle the traffic coming out of a Costco parking lot during busy times.",3
1269,l3vwbg9,mmmmmarty,1715624488.0,The stores are pretty spartan but the prices are right and managers are good about getting requested products on the shelf.,1
1270,l3uzicp,AutoModerator,1715613141.0,"No vague or non-descriptive post titles.

Posts that don't follow r/Costco subreddit rules MAY be subject to removal. 

When applicable, please make sure that you're using a descriptive post title with product name(s) mentioned as it yields better subreddit search results. Including item number, price, and approximate location where found is also helpful. Thank you.


*I am a bot, and this action was performed automatically. Please [contact the moderators of this subreddit](/message/compose/?to=/r/Costco) if you have any questions or concerns.*",1
1271,l3v0fvq,Pittipants,1715613470.0,"Yeah if you don't like Stevia you have to check label. A lot of times you will see ""no artificial sweeteners"", but Stevia and monk fruit are considered natural so they may have it.",54
1272,l3vfwjn,TechieGranola,1715618865.0,"I love these, glad Costco has them now",19
1273,l3v4mtp,FlyingOcelot2,1715614950.0,Thanks for the warning!  It saves me having to wrestle the box to look at the ingredients.,7
1274,l3vclqo,dietcokeeee,1715617722.0,I actually love this one so much 😭 the strawberry banana one is meh,7
1275,l3vmhp7,katylovescoach,1715621135.0,I hope my Costco gets these - I’ve been buying 20 of them every two weeks at Target for months as my breakfasts and it’s getting annoying,5
1276,l3v7gxr,MethanyJones,1715615939.0,That stuff is very expensive for what it is,3
1277,l3vhfsy,aaactuary,1715619393.0,ohh which warehouse and how much were they?,2
1278,l3vi1xj,natrldsastr,1715619604.0,"Huh. I use stevia in my coffee, have for years. Yes it has a different aftertaste but I'm conditioned to it so I might like this. I'll have to find a single somewhere and try.",2
1279,l3v706c,therealgariac,1715615778.0,"This times a thousand. One of my few returns to Costco was a Gatorade variant advertised as low sugar. Silly me, I thought it was Gatorade with, you know, less sugar. Nope they doped it with stevia. 

Costco would do themselves a favor to post ""Contains Stevia"" or ""Contains Monk Fruit"" to reduce the number of returns.",1
1280,l3vhb9w,Simple_Actuator_8174,1715619351.0,It also has chicory root (inulin) for the fiber. I hate the taste and what it does to my gut.,1
1281,l3vxho7,Cyber_Insecurity,1715624887.0,Yogurt drinks are never good.,1
1282,l3vnim6,cardinalsfanokc,1715621486.0,Didn't realize I needed your endorsement on anything.  Read the label if you hate a specific ingredient commonly used in low sugar stuff 🤷🏻‍♂️,0
1283,l3v8n36,Survive1014,1715616350.0,Chobani has a very narrow category of products that are good. The rest are super gross.,-3
1284,l3v96ci,Shot_Woodpecker_5025,1715616537.0,This stuff is awful!,-4
1285,l3vafts,Amazing-Bag,1715616977.0,You had trouble swallowing the yogurt due to it's taste?,-8
1286,l3v2b7g,seztomabel,1715614134.0,Monk fruit is more versatile than stevia at least.,6
1287,l3v4q56,future_luddite,1715614983.0,"Yes, I love less sweetness in things and every few weeks I accidentally buy something loaded with Stevia, which I hate.",3
1288,l3vvx3w,ProgressBartender,1715624352.0,And thanks to your friendly neighborhood sugar industry everything has sugar in it.,1
1289,l3v10p0,RobotMaster1,1715613673.0,Some day i’ll learn my lesson and do that.  I think the confusion for me comes because Costco also sells a more clearly labeled “diet” greek Chobani yogurt.  Or used to anyway.  But even then I think it may just say zero sugar instead of zero added sugar.  I guess i’m easily confused.,-2
1290,l3vrlbv,Delicious_Slide_6883,1715622871.0,I can’t wait to try them. I hope ours has them. I love stevia- it’s the only sweetener that doesn’t taste artificial or have an aftertaste for me,3
1291,l3vi22d,fuckedfinance,1715619605.0,"Or, I don't know, people could read the ingredients.",10
1292,l3v9ht8,RobotMaster1,1715616649.0,"ironically, their “normal” yogurt is too sweet for me so I guess i’m hard to please.  just wish we had a sugar alternative that didn’t have a funky aftertaste.",3
1293,l3vapa4,RobotMaster1,1715617067.0,where in my post did i imply anything like that?  i drank some and didn’t like it.,3
1294,l3vuj68,Guilty_Jackfruit4484,1715623878.0,A lot of grocery stores sell them in singles I'd you didn't want to commit to a bulk pack.,5
1295,l3vuy3p,therealgariac,1715624021.0,"Or Costco could just post it and save themselves money.

This is known as being part of the solution.",0
1296,l3vkm1x,chickadeee,1715620489.0,"I’m with you, most yogurt is way too sweet, especially if it’s low fat kind. I just buy whole milk unsweetened (some brands are better tasting than others) and make sure ingredients don’t have any thickeners or corn starch, just milk and cultures. Then I add honey with vanilla extract or jam or home made syrup.",2
1297,l3vh4g9,AutoModerator,1715619285.0,"No vague or non-descriptive post titles.

Posts that don't follow r/Costco subreddit rules MAY be subject to removal. 

When applicable, please make sure that you're using a descriptive post title with product name(s) mentioned as it yields better subreddit search results. Including item number, price, and approximate location where found is also helpful. Thank you.


*I am a bot, and this action was performed automatically. Please [contact the moderators of this subreddit](/message/compose/?to=/r/Costco) if you have any questions or concerns.*",1
1298,l3vj2en,Tatsunashi,1715619954.0,these look interesting! awaiting the feedback,3
1299,l3vuk03,thiccboyIV,1715623887.0,The pancakes are really good. This looks even better. Couple of these with a scoop of ice cream and you are set for immediate gains,0
1300,l3r8ul7,AutoModerator,1715545189.0,"No vague or non-descriptive post titles.

Posts that don't follow r/Costco subreddit rules MAY be subject to removal. 

When applicable, please make sure that you're using a descriptive post title with product name(s) mentioned as it yields better subreddit search results. Including item number, price, and approximate location where found is also helpful. Thank you.


*I am a bot, and this action was performed automatically. Please [contact the moderators of this subreddit](/message/compose/?to=/r/Costco) if you have any questions or concerns.*",1
1301,l3rpgh8,kevin0611,1715551729.0,I’m using an old M&M’s tub. Like a f***ing neanderthal.,119
1302,l3rahrb,vincomycin10,1715545813.0,Same. I hate the plastic bags. Hard to seal back up. I do EXACTLY the same.,112
1303,l3rfckt,Alaska2Maine,1715547675.0,I usually just fill up reusable glass containers. I would worry about the plastic tubs getting nasty over time,39
1304,l3rbvq3,Angry_Robot,1715546346.0,My greatest regret in life is that I did not. Those bags are the worst.,49
1305,l3sf66e,MrPrettyKitty,1715562958.0,My grandson and I use them to catch anoles and geckos. We call it the lizard collector.,7
1306,l3ri96o,villanoushero,1715548818.0,"I have the chocolate covered almonds containers holding my yougurt pretzels , caramel clusters, sugar and costco dog food. 
They are so useful",6
1307,l3s6ne4,JustineDelarge,1715559249.0,I just transfer them to an OXO POP container.,5
1308,l3rkmg2,Ingawolfie,1715549756.0,Wish that could have been an option for the rotisserie chicken containers. We hate the plastic bags. The employees hate them too they tell me.,7
1309,l3rio4u,bobonabuffalo,1715548980.0,"My dad’s workshop is filled with a bunch of them from like 1999 for things like screws, nails and of course mixed nuts.",3
1310,l3s5zc4,Shrug-Meh,1715558949.0,"I warn my family to never, ever (ever!)  throw the container out. The first time I emptied a bag into the old container I was pleased to see it filled the container to the top.",3
1311,l3rmaxl,AshDenver,1715550430.0,"We did, the salted cashews go from bag to tub!",5
1312,l3rqqtp,FirstShit_ThenShower,1715552273.0,"Raises hand! We kept two of them, wash and pour the nuts from the bag into them.",2
1313,l3rtc1z,nbaaftwden,1715553374.0,"Our cashew container was in the recycling bin when I brought home some in the new plastic bag. Luckily, we were able to dig it out! That was a close call",2
1314,l3ruvpf,AZNM1912,1715554039.0,Glad I’m not the only one!,2
1315,l3sgppf,Pretty-Win911,1715563643.0,Same with the jelly belly jars. Thank goodness I kept one.,2
1316,l3shb4z,Servile-PastaLover,1715563906.0,Yes...also the 4 pound Jelly Belly tubs.,2
1317,l3udi6j,-1967Falcon,1715604595.0,As a Filipino- I now use it as a lunchbox container.,2
1318,l3ret6k,WtA1337,1715547465.0,I wonder if they sell extras online,2
1319,l3rit3p,Sighvanski,1715549036.0,meeee they're good for storing screws and random tool stuff,1
1320,l3rq3q7,BlueAc215,1715552001.0,Mad I didn’t,1
1321,l3rvq6f,Twar121,1715554404.0,All my nuts are stored in the old containers and none of them match the label! Very tricky at times!,1
1322,l3rvqlf,sjrthethird,1715554409.0,I did! I’m kinda upset that I didn’t save one of the chicken containers too.,1
1323,l3rz1vt,sc4kilik,1715555853.0,"I buy the Great Value salted nuts at Walmart and they still come in square jars, so I'm still getting my supply.",1
1324,l3rz7sm,werty246,1715555924.0,Mines full of screws and other misc fasteners.,1
1325,l3s3qxq,efe13,1715557940.0,Wish I saved a rotisserie chicken container 😢,1
1326,l3s40p0,Joyce_Hatto,1715558063.0,We did.,1
1327,l3s82nw,werdx,1715559881.0,Yup. On refill #3. The bags are hot garbage.,1
1328,l3s8ip7,Peanutsmom885,1715560079.0,"I saved mine and use them for rice, sugar, oatmeal.    Husband uses them for screws, washers, etc.   See-through and stackable, we find many uses for them.",1
1329,l3sde3v,Ezypeezylemonsqueezy,1715562189.0,"I saved the powdered PB jar, thank goodness!",1
1330,l3sdrvs,lhfitz76,1715562347.0,"Saved the container, but think supplier changed also and not near as good.The almonds are no longer toasted with crunch. Tried twice. Won't buy a third time.",1
1331,l3sho23,poopatrip,1715564063.0,"Kept one mixed nuts, and two cashew. One cashew for inside the house, the other two for garage snackin while drinking. ",1
1332,l3sre8a,LuckyStabbinHat,1715568365.0,Are they at least fancy?,1
1333,l3srp0p,Blue_Bunny_2463,1715568504.0,My wife does that,1
1334,l3sytme,65shooter,1715572019.0,I saved my cashew and Jelly Belly containers too.,1
1335,l3szo4i,kittiesandchocolate,1715572473.0,I’ve done this with dishwasher pods and laundry detergent pods- so glad I saved the containers!,1
1336,l3t2me0,Feelsliketeenspirit,1715574089.0,My husband recycled it!!! 😭😭😭,1
1337,l3t7amw,Greengiant0428,1715576807.0,"Yes, I saved the container. Don't like the bags at all. However, the weird thing is that when we dump the nuts in the container, there isn't enough room, as the new bag actually gives you more nuts than before.",1
1338,l3ueu1s,bachd24,1715605184.0,I put my in mason jars and vacuum seal them for longer freshness since it takes me forever to finish them,1
1339,l3vwml0,BigFire321,1715624592.0,I got a whole closet full of empty Nuts plastic cans.  They're so useful.,1
1340,l3rl85e,MACmandoo,1715549998.0,"I’ve been refilling the old containers too. Any need to worry about old plastics leaching unhealthy chemicals?  If I didn’t have young kids, I’d switch to glass I suppose.",1
1341,l3rpoi3,stlthy1,1715551823.0,"You poor bastard.

The embarrassment you must feel.",32
1342,l3ru9u6,mikesmithhome,1715553778.0,haha me too peanut m&ms baby! for the red bag of cashews tho not the mixed,4
1343,l3sj684,RaVashaan,1715564728.0,"Me too.  Though I used Goof Off 2 to remove the label, so I don't have to be reminded of my shame. 😛",7
1344,l3rzeb7,santa_veronica,1715556003.0,"That reminds me, I have a little M&M dispenser somewhere!",3
1345,l3sseio,norcalifornyeah,1715568834.0,Was it peanut butter m&ms tho?,3
1346,l3rz9lt,santa_veronica,1715555947.0,Just washed out my old container and wish I had kept more of them!,28
1347,l3rzvhj,lkodl,1715556213.0,i put the whole bag inside of a gallon zip lock,3
1348,l3rggap,stlthy1,1715548111.0,"I hand wash it with dish soap, every other time",23
1349,l3rsti2,cyberspirit777,1715553156.0,"Plastic expires and isn’t as easily cleaned to me, so I do the same. I find lots of good glass containers at the dollar store sometimes.",11
1350,l3up2w9,Specialist_Chart506,1715609328.0,I use the large wide mouth mason jars for my nuts. An entire bag fills it up with a handful left over for a snack.,2
1351,l3s58ox,Imnotveryfunatpartys,1715558614.0,"I do think that food will take on the flavor of the plastic over time. I had an open bag of pistachios from costco for about a year and when I opened up a fresh one there was a noticeable difference. 

Maybe it could just be a general staleness but I really feel like the plastic seeps in",3
1352,l3rt7o1,tallllywacker,1715553323.0,You can buy jars on Amazon or at dollar tree tho,13
1353,l3sycre,ArcherFawkes,1715571774.0,"Lol, that's great. Have you caught any funky ones lately?",2
1354,l3skg5n,Khashayarshah3,1715565298.0,"yeah, makes the job take longer too do and if we run out of chickens we get in big trouble, costco reasonsing is ""it saves on shipping"" cool bruh yall say you take care of your employees obviously not when chicken room was already a sweatshop, now it a shien factory",4
1355,l3rhj7r,krillins_a_beast,1715548536.0,I'll sell you mine for $500,10
1356,l3s72f8,cindycated888,1715559432.0,"Nope, you'll have to get some peanut butter pretzels now. 😄",1
1357,l3u07dx,stlthy1,1715597676.0,It fits...ya gotta shake.,1
1358,l3rtkoj,stlthy1,1715553475.0,"Yep...only ""1""s (PTE) & ""2""s (HDPE) actually get [recycled](https://yesstraws.com/blogs/news/types-of-plastic-plastic-numbers-guide).  

Everything else is a lie.",4
1359,l3s4c5n,HighHammerThunder,1715558206.0,"Yeah but just because they're chucked in the bin doesn't mean that it's actually getting recycled at the facility. That often isn't the case with plastic, and containers that are recycled aren't done so with perfect efficiency. Plus, more consumers than you would think choose not to recycle.

The most important step is to reduce the amount of plastic that we manufacture in the first place. If they aren't using recycled plastic to produce either container, then it's more friendly to use the bag. It really doesn't matter what happens to it after that because the whole consumer to recycling process is so inefficient.",3
1360,l3s7gmg,sanfranchristo,1715559608.0,"And nearly all plastic that goes in a recycling bin gets diverted to a landfill anyway. For practical purposes, neither the bag nor the tub are recyclable so the less plastic used for single-use packaging the better.",2
1361,l3rsnlb,stlthy1,1715553085.0,"If you're asking me, I'm a haggard Gen-Xer that's composed of mostly hazardous chemicals, at this point.

I shrug and laugh at unhealthy, leached chemicals.  I am the one who knocks.",6
1362,l3rpw8m,kevin0611,1715551914.0,We can’t even have people over anymore.,38
1363,l3saash,hu_gnew,1715560860.0,"I have about a dozen of the mixed nut or choco covered almond jars, used to store a variety of things around the kitchen, house and shop. Even have some larger, gallon sized ones that almond biscotti came in. These are perfect to hold a small bag of wood chips I use in my smoker.",14
1364,l3vwkfz,LoveOfSpreadsheets,1715624572.0,You can for the moment get some of the Candies in jars still and repurpose them. Plus you get to enjoy some chocolate covered raisins!,1
1365,l3slf3v,badger_flakes,1715565722.0,It’s still degrading even if you’re washing it. Not really meant to be reused in that way.,8
1366,l3uvd3d,MomsSpagetee,1715611644.0,I would need extra wide mouth jars for my nuts.,2
1367,l3rtte5,One3Two_TV,1715553580.0,"I would advise every that buy things like rice, beans, coffee, sugar, and use it regularly, to have a container for it.

Nuts included!

For rare use, dont, or do, idc",10
1368,l3uihry,WeekendQuant,1715606747.0,Just get mason jars.,2
1369,l3u5bjc,MrPrettyKitty,1715600593.0,"It’s bright green ones this time of year. We catch them, examine them closely, then let them go. Woe be unto them if they climb on the outside of the screen though - my grandson will flick the screen to see them fly.",3
1370,l3srd9d,Ingawolfie,1715568353.0,"I am also a shareholder and trust me there will be a discussion at the shareholder meeting. We’ve been shareholders since the early days, we love Costco so much. But now we have to get a box to keep them from leaking everywhere. So it’s generating even more waste, besides struggling employees.",2
1371,l3rm5r8,IFLYBFJ,1715550374.0,FTW!,1
1372,l3t9lju,ButtercupsPitcher,1715578256.0,Ahh! A fellow hose water drinker like myself?,3
1373,l3rq2cu,stlthy1,1715551985.0,[Shame](https://youtu.be/1GiPcP30cFc?si=X3M7Sc_78SO24Wpx),7
1374,l3sbbq2,santa_veronica,1715561298.0,Who knew?,2
1375,l3v9jh7,Paupy,1715616665.0,"Plastics can leach into the food products contained within them as they degrade so for this reason we generally use glassware storage containers. If you're considering repurposing a plastic storage container check out its recycling symbol. If it's #5 plastic it's made from polypropylene which is US FDA food safe and in general also BPA free, dishwasher and microwave safe. This is the same material used to produce Tupperware, Gladware and some Rubbermaid products.",2
1376,l3t8xbh,cshotton,1715577822.0,You have funny ideas.,-8
1377,l3s8zuz,tallllywacker,1715560287.0,Better for the environment too I’m sure. Wah wah we don’t get to buy a disposable container anymore - get over it. Planet is dying pal,5
1378,l3usd7o,PhoenixRisingToday,1715610550.0,How is using a box that was destined for the landfill already “generating more waste”?,1
1379,l3uownu,stlthy1,1715609264.0,"I was an Eagle Scout.  I'm pretty sure the canteens I drank out of (that I got from my grandfather from his time in WWII) were made, partially, of lead.

Hell yes, I drank out of hoses.

Long live the last generation of feral kids.",1
1380,l3sb44t,One3Two_TV,1715561206.0,"Bags are no doubt better for the environment than a hard plastic container, and i bet they can ship more this way which is again helping with pollution 

The true pollutors are the big ship and planes so if we can increase how many items is shipped per square meter its always positive",4
1381,l3vs3ny,AutoModerator,1715623045.0,"No vague or non-descriptive post titles.

Posts that don't follow r/Costco subreddit rules MAY be subject to removal. 

When applicable, please make sure that you're using a descriptive post title with product name(s) mentioned as it yields better subreddit search results. Including item number, price, and approximate location where found is also helpful. Thank you.


*I am a bot, and this action was performed automatically. Please [contact the moderators of this subreddit](/message/compose/?to=/r/Costco) if you have any questions or concerns.*",1
1382,l3vuxq3,EhDub1,1715624017.0,Sooooo….. how is it? Read only avail in Bay Area Costco so not likely to see it here in the valley. Seems like an interesting flavor but think I’d want a sample 1st.,2
1383,l3vw7hz,KaleidoscopeLucky336,1715624450.0,I don't have confidence lays can do a good 'Korean flavor inspired' chip.  Just get an actual Korean bag of chips,1
1384,l3vojro,AutoModerator,1715621835.0,"No vague or non-descriptive post titles.

Posts that don't follow r/Costco subreddit rules MAY be subject to removal. 

When applicable, please make sure that you're using a descriptive post title with product name(s) mentioned as it yields better subreddit search results. Including item number, price, and approximate location where found is also helpful. Thank you.


*I am a bot, and this action was performed automatically. Please [contact the moderators of this subreddit](/message/compose/?to=/r/Costco) if you have any questions or concerns.*",1
1385,l3vszf1,soulsofmischiefs,1715623348.0,Location,1
1386,l3vtpww,VinylHighway,1715623602.0,Do you people have families or are singles/couples eating an entire cake every week?,1
1387,l3vuk9v,Aspen9999,1715623889.0,They have both these at the Georgetown Tx location,1
1388,l3vuywd,Aspen9999,1715624028.0,"Helpful hint. Cheesecake can be frozen. I slice individual slices, freeze on a baking tray, place 2  into ziplock bags.",3
1389,l3vv0o9,VinylHighway,1715624045.0,Thanks !,1
1390,l3vv69f,Aspen9999,1715624098.0,"You are welcome, it’s just my husband and myself but he has a sweet tooth.",2
1391,l3vva0d,VinylHighway,1715624133.0,It’s a great idea,1
1392,l3vrz40,AutoModerator,1715623002.0,"No vague or non-descriptive post titles.

Posts that don't follow r/Costco subreddit rules MAY be subject to removal. 

When applicable, please make sure that you're using a descriptive post title with product name(s) mentioned as it yields better subreddit search results. Including item number, price, and approximate location where found is also helpful. Thank you.


*I am a bot, and this action was performed automatically. Please [contact the moderators of this subreddit](/message/compose/?to=/r/Costco) if you have any questions or concerns.*",1
1393,l3vuorb,Briggity_Brak,1715623932.0,"Yep, i'm dead if my costco ever starts carrying the yellow or purple dots. Also, how's the seasoning? The one time i bought the red ones from costco, it tasted like they just put the normal amount of seasoning in a bag twice the size (quite bland compared to normal bags from the grocery store).",1
