,ID,Author,Time,Comment,Score
1901,l3n6g8u,AutoModerator,1715471463.0,"No vague or non-descriptive post titles.

Posts that don't follow r/Costco subreddit rules MAY be subject to removal. 

When applicable, please make sure that you're using a descriptive post title with product name(s) mentioned as it yields better subreddit search results. Including item number, price, and approximate location where found is also helpful. Thank you.


*I am a bot, and this action was performed automatically. Please [contact the moderators of this subreddit](/message/compose/?to=/r/Costco) if you have any questions or concerns.*",1
1902,l3n76z7,Immo406,1715471791.0,"Bring that shit to your GM, wtf….? Let him know you were charged $10 without your approval.",3868
1903,l3n7fjz,Koffenut1,1715471896.0,I'm going to guess that padding the donations somehow reflects positively on that manager's stats.  This definitely needs to go to the GM or corporate.  It's basically extortion.,2549
1904,l3nagyz,OhHeyItsBrock,1715473253.0,Ain’t gonna be a manager for much longer. Use the whistle blower feature on the employee website.,1104
1905,l3n90yq,Adept-Opinion8080,1715472606.0,"yea, big no.",162
1906,l3n7tnu,Kjlreddit,1715472069.0,That’s a big red flag.,425
1907,l3n8mg4,2squishmaster,1715472427.0,Oooo sheet that manager gonna get in trouble!,392
1908,l3nborh,LowFatHam,1715473807.0,Adding on to say that is extremely sketchy and likely illegal. Please give us an update when you have one!,66
1909,l3n9oux,DeathMonkey6969,1715472900.0,That's fucking fraud. They need to be kicked to the curb.,223
1910,l3ndie4,VixxenFoxx,1715474630.0,"Open Door Policy, take it to the GM or call your regional. That's absolutely BULLSHIT. Donations to CMN are voluntary.",61
1911,l3n9xrf,igeekone,1715473012.0,It's the hallmark of a bad manager. Costco needs to nip this in the bud.,128
1912,l3n93ks,Madrona88,1715472638.0,Time to use that open door policy.,76
1913,l3na1ms,DanCQueen,1715473060.0,"Yeah that’s not logical. I would let the GM know, or corporate: utilize the open Door policy. You can find the HR number on the intranet if you want to speak to someone live. ",76
1914,l3neiok,FrostyMission,1715475088.0,Bring the receipt to customer service and return it.. get a refund.,38
1915,l3nj4u6,HurtingHead,1715477229.0,We are going to need updates on how this works out.,33
1916,l3ncp7v,b92,1715474265.0,Such a dumb way to be fired lol,54
1917,l3nbn2h,LentVMartinez,1715473785.0,I would be livid if a fucking manager did that to me to juke up their donation stats,26
1918,l3nd4nd,PlatformFrequent4052,1715474457.0,The manager needs firing. I don’t know how Costco could trust him in financial matters.,49
1919,l3n9v09,dleifkerTX,1715472977.0,"Start working your way up the chain and demand that Costco clarify its policy about requiring employees to donate to charities against the employee's will.  Simply asking this absurd question will probably cause an investigation and an apology.  Sounds like the new manager has been pressured to get employees to donate to this charity, but he doesn't understand the difference between ""ask"" and ""require.""

This happened a lot when I worked for a government contractor.  My employer wanted to boast about all the employees who donate to the United Way, and every year every department was forced to find someone who would track the percentage of employees who donated and then to pressure the employees who did not donate.  But we were smart enough to merely pressure the employees, not require them to cough up $10.",22
1920,l3ncg0l,Lanky_Possession_244,1715474150.0,No. You need to report that. He hustled you into donating to CMN to make himself look better.,39
1921,l3nbxch,Like1RandomDude,1715473915.0,That’s BS. Take it to the GM.,17
1922,l3nnjk6,Flooded_Strand,1715479268.0,"I wouldnt even go to your GM about this, you should escalate that straight to your district manager. It'll be better if they hear it from up top first when it comes to something this serious.",17
1923,l3ofhmf,Creepy-Selection2423,1715495094.0,"Make the GM aware of it immediately. If you really want to get results, take the high road, and say that you don't want the $10 back, and that you are happy to donate to the children's miracle network, however, you are concerned that other employees might not be able to afford it and you are not comfortable that they were forced to donate.  Make clear it isn't about you, but that you believe in see something say something, and that you don't believe what you saw is right.  Also express concerns that you think this manager might be padding his numbers at the expense of those employees who may not be able to afford the donation.",15
1924,l3nas9d,izelo95-,1715473397.0,Yeah either talk to your gm or call corporate to report the manager. You can just refund the donation at membership. Tell them that manager can piss off lol,14
1925,l3njnqy,Tyr808,1715477476.0,"Not a lawyer, but I'd casually wager that him straight up mugging you for $10 would be less illegal than what just happened here. 

Depends on how exactly every law applies as is always the case, but an illegal fee on a subordinate at work is severe enough when you don't involve charities and presumably your own position at work benefiting from those donations in some fashion.",13
1926,l3njsmr,Mike_619,1715477541.0,As an internal investigator let the GM know or if you feel they’re all doing the same then use a hotline Costco provides. Trust me they will review this transaction on video and run his employee number through a reporting system.,14
1927,l3ngqv4,Kirin1212San,1715476112.0,Ew. That’s so slimy.,13
1928,l3ng9oc,OrdinaryBrilliant901,1715475890.0,100% not true and completely unacceptable!,11
1929,l3nuppb,J_IV24,1715482715.0,"Absolutely not legal. Don't complain to your company, complain to your state labor board with the reciept",22
1930,l3nkrio,ThatOneTypicalYasuo,1715477979.0,Fuck this person,9
1931,l3o235h,Talrynn_Sorrowyn,1715486612.0,Reminds me sort of how my company used to have competitions every year for the checkers to see who could get the most customers to dknate for some nonprofit campaign.It was fine up until it was discovered checkers were outright tacking on $0.50 donations to every customer they had whether they informed the customer or not.,7
1932,l3oy26c,stonecats,1715509188.0,"life lesson;   
whenever any worker does something hinky like this,    
quietly leave your items at the cashier and walk out  
*even if it's your own employer*.  

California has a ""no surprises act"" which make it   
illegal for vendors to tag on costs after the fact   
that were not clearly disclosed before purchase.",8
1933,l3pemdd,puledrotauren,1715519127.0,We did something similar when I was the grocery manager on nights.  When we got done with the truck I'd ring up all of the crews purchases and we'd go on our merry way.  If upper management told me to charge extra on an after hours purchases I'd have had a good laugh and said 'No I will not be doing that'.  My guys making minimum wage were barely scraping by on what they were making.  No way would I allow them to get fucked over by corporate.,8
1934,l3o19b4,leo_4tw,1715486159.0,"You'd get fired at my store for doing that, manager or not.",14
1935,l3no661,Apprehensive_Cow5139,1715479561.0,Not legal,8
1936,l3ob6cz,The_pizza_pirate,1715492129.0,Absolutely not. They’re trying to get their CMN donations in an incredibly immoral and illegal way. Take that up with your GM and if they don’t do anything go higher because that’s reprehensible. I’m a Costco supervisor of 3 years and can tell you with 100% certainty that’s just not a thing.,7
1937,l3rltmb,FirefighterForward52,1715550239.0,"Correct me if I’m wrong, but if I give a few bucks at the register as I pay for my haul , COSTCO corporation gets the tax deduction while me, the guy who gave….gets nil….?",6
1938,l3nm4o6,SquirtlePaPa,1715478603.0,"Literal fraud, ESS>whistleblower. Don’t try to take it up with warehouse manager, I’d tell them in advance you’re contacting corporate as to not “go over their head” but I learned the hard way that relying on warehouse manager gets you nowhere with sketchy managers.",13
1939,l3nbg5o,C-mo1984,1715473698.0,Wish my store allowed purchases outside store hours :S,4
1940,l3niuqt,Low-Stomach-8831,1715477100.0,"What?! No. After hours, you're just a customer like everyone else. They can give you discounts, but they can't overcharge you!",6
1941,l3nxs07,HernandezGirl,1715484291.0,"Yeah I never donate that way, ever.",5
1942,l3o35p9,HungryMudkips,1715487219.0,this seems......highly illegal,6
1943,l3o9g8w,Khashayarshah3,1715491000.0,"Tell the GM, that guy pocketing the money or something, our warehouse lets us do this as well annnnd i've worked for costco for 10 years so far, have never heard of there being a $10 charge to purchase stuff after hours LOL but yea tell the GM if they don't do nothing then email [humanresources@costco.com](mailto:humanresources@costco.com)",6
1944,l3nk93d,Crusty_Vato,1715477747.0,Please give us an update when this jackass gets demoted or hopefully worse.,15
1945,l3p9s0d,greeperfi,1715516624.0,"Lawyer here, no this is 100%  illegal.  You *could* google ""[your state] wage complaint"" and file a complaint which is free with your state.   Some red states no longer have this option but most do and even in Texas this would be illegal.    

I would first go to the manager and ask that it be given back. If you are disciplined you should add a retaliation claim to your complaint.  Finally, as added protection, go to your manager with another employee, as this will count as ""concerted activity"" that is protected by the NLRA.  If they retaliate in any way, file a complaint with the NLRA for retaliation against concerted activity; this is federal so even if you are in a red state you will win.  

Honestly Costco is a good employer so your best bet is to resolve the issue internally, they very likely have an employee hotline and given the recent unionization of a Costco location, they will refund your money and probably demote the manager.",11
1946,l3nkb0f,myloteller,1715477771.0,Costco better fix that guy before the labor board fixes costco. Thats super illegal,10
1947,l3nottd,RhythmTimeDivision,1715479867.0,"On my Costco trip last night the donation soliciting dude behind the registers was going ALL OUT. 

Small bullhorn, walking up and down the rows of shoppers. It was a little too much. Really awkward stuff. I see you, I know, I have a donation in my hand ready to go. Ease off, bro. 

Between your story and what I saw last night, do they have quota's or something? Does the highest collector get a car or something? Yeesh!",11
1948,l3nt2xi,Boring_Inflation_507,1715481907.0,Please update us on what happens!!!!!,5
1949,l3o8hq0,PettyBestServedIcy,1715490387.0,Children’s Hospital enters chat: “umh what donations?”,5
1950,l3ru3bi,jsndndjjsjajksndnd,1715553700.0,"Absolutely report this. I donated almost $300 to CMN. The FR Sup who rank it up isn't even on the ""leaderboard"" top 5 list we hang up. He refuses to be.

If a Manager forced you to spend an extra $10 after hours to shop, that is so absolutely unethical that I don't even know what to say.

One of the perks of working at Costco is being able to shop after hours. There's absolutely nothing in the employee agreement that says they can compel you to do this.

I wouldn't even report it to the GM, I'd report it to Corporate via the whistleblower portal.",6
1951,l3sd6tr,HideousYouAre,1715562101.0,Whistleblower link. Use it. That’s a huge no no!,6
1952,l3o88vy,Here-We-GOOOOOO,1715490231.0,"I work at a hospital that receives those donations and it hurts to hear you were forced to donate. It reflects bad on Costco, children’s miracle network and the hospitals. You should absolutely report this to higher up, that manager should be fired asap.",10
1953,l3nc350,MistahNative,1715473986.0,Yah that’s stupid and extremely unethical. That Manager may be finding a new job pretty soon.,11
1954,l3pb934,FUguru,1715517419.0,"Absolutely illegal, unethical, outrageous. Escalate to central HR. Costco forced charity on employees is yet another example of their questionable ethics. There is reason employees are unionizing across the nation.",10
1955,l3nk61a,RedditIsStupid01,1715477709.0,"100% not allowed , you need to talk to the gm",5
1956,l3ns3i8,excitum_,1715481433.0,"Yeah that’s not okay. At. All. 

Needs to be reported.",4
1957,l3o02bv,misterpoopsies,1715485505.0,Had a coworker who did something similar at the movie theatre. Would charge people something harder to keep track of. Like popcorn refill or something. Pocket the cash and just point people to their theatre number. Figure your manager is probably doing something shady like this too,5
1958,l3o1yzk,City_Standard,1715486548.0,This is not right. Please do a follow up. ,3
1959,l3oaxoh,The_pizza_pirate,1715491968.0,Absolutely not. They’re trying to pass their CMN donations in an incredibly immoral and illegal way. Take that up with your GM and if they don’t do anything go higher because that’s reprehensible. I’m a Costco supervisor of 3 years and can tell you with 100% certainty that’s just not a thing.,3
1960,l3ocqs3,2009altima,1715493188.0,"Today I learned, Costco managers get graded on the amount of CMN donations they can hustle.",4
1961,l3oi0k6,bbauered,1715496918.0,yeah I've worked for costco for 12 years and that is absolutely hot allowed/okay! wtf?!,3
1962,l3r1zzp,I-love-to-poop,1715542569.0,Time to pay a visit to the GM,4
1963,l3scztt,Ashamed_Donut2176,1715562015.0,"This is not ethical, HR would eat this manager alive for this. Whistle blow the crap out of this.",4
1964,l3n8x2b,i_justwanttocuddle,1715472558.0,Probably pockets the money I wouldn’t of paid it,24
1965,l3nosn0,NorCalFrances,1715479852.0,"That reeks of a manager trying to boost either his own income or the store's tally for the corporate donation to the children's hospital. Either way, check with the district manager 'cause that does not feel legitimate.",8
1966,l3nwfu9,Odd-Bus9202,1715483595.0,"I'd also tell the manager next time they call me off the clock ""I charge $10 for work communications outside of my scheduled hours.""",7
1967,l3neam8,Horrible_Karaoke247,1715474988.0,So... what manager? A staff level manager or Assistant Warehouse Manager?,7
1968,l3qa9sh,Sir-Kyle-Of-Reddit,1715532008.0,Absolutely not legal. Tell your corporate office or HR person immediately.,6
1969,l3oeqfl,itscurt,1715494560.0,So what discounts do y'all get?,3
1970,l3p2av5,First_River86,1715512180.0,That’s considered theft. You need to turn him/her in to your AGM or GM.,3
1971,l3p2q5o,Infinite-Cucumber-70,1715512456.0,Donating is extortion in general.,3
1972,l3p6fnh,TurboClag,1715514731.0,Forced charity donations in this economy? Rabble!!!,3
1973,l3ql5gr,TheSteve1778,1715536110.0,"Short answer: no.

Long answer: nooooooooooooooooo.",3
1974,l3n995l,HeyGirlBye,1715472707.0,Weird we donated $5 and it showed up as $10. We mentioned it and the guy said something about a potluck? Obv would never ask for the additional $5 back but I have no idea what was what.,5
1975,l3pxime,Jewhard,1715527053.0,How can you be sure that the ‘donations’ are actually getting to the Children’s Hospital and aren’t just going into the Managers pocket? This is dodgy AF and I hope OP reports it (to the top. Don’t be pissing around with the next manager up). To the moon Alice!,5
1976,l3o1md6,tnguyen600,1715486359.0,🍿🍿🍿,4
1977,l3om2ge,deVrinj,1715499947.0,"Not a lawyer

BUT

Ten Dollars rung up as a donation is actually a forced tax write-off that you are forcibly paying for Costco. Look like you have a case.",3
1978,l3ouu9r,canon12,1715506735.0,At checkout last week in Costco the clerk was overly pushy about getting a donation for the children's hospital.  I kept saying no and she wouldn't complete the sale until she went through spiel about it.  I had to tell her NO in a more stern voice before she let it go.  Even after this she followed me in the aisle to talk about it.  My first reaction was Costco had a contest going on and there was a prize for the clerk with the highest collection.  Costco...stop it!,3
1979,l3o7ko2,JWWBurger,1715489816.0,"Post an update, please.",2
1980,l3oc6es,Walkgreen1day,1715492808.0,I went through checkout a few weeks ago and was pretty much guilted into donating for this charity. The employee did this to every single person that she was checking out. She rang the bell whenever there was a donation and acted like she was the greatest. I'm thinking that OP's manager took advantage and forced them to donate so he/she could get the credits for the charity donation. Report them to the higher up and let them deal with it.,2
1981,l3qbxlp,drs-off-receptionist,1715532643.0,"So can you charge $10, then refund and pocket the multiple $10 charges?",2
1982,l3qpzf3,Embarrassed-Camera-7,1715537949.0,"No its not, talk to your GM.",2
1983,l3skadu,Commercial_Ad_6562,1715565227.0,This seems very illegal,2
1984,l3st3n3,molliechipper,1715569169.0,"Did the manager charge you for your items also?
I’m confused if he just rang a flat $10 but didn’t scan your items?",2
1985,l3o9mrs,ipini,1715491118.0,Never make donations at the till. The corporation makes the overall donation and then receives the tax break. You’re just helping them avoid larger societal responsibilities by avoiding taxes.,6
1986,l3qhvfz,GripLizard,1715534881.0,Illegal AF,3
1987,l3q35am,EddieCutlass,1715529278.0,"Yeah, that isn’t right. 
Side note: You can donate yourself…instead of Costco getting the tax incentive",3
1988,l3nx8ru,HernandezGirl,1715484011.0,What an A hole,2
1989,l3pptuy,Castlebrookqueen,1715524046.0, Sounds about right. If I know Costco they’ll just make you all sign a NDA and never talk about it again.,2
1990,l3pwbqf,KuyaJester,1715526558.0,"You should charge him a “anti-blackmail”fee of $10,000",2
1991,l3s9159,RebbyXP,1715560303.0,It is CMN (Children's Miracle Network) for May but they can't force you to donate. I'd definitely speak to a higher up.,2
1992,l3nn4rv,PatSajaksDick,1715479075.0,The fact that there’s goals for donations to charity means Costco is getting some sort of cut or something right? I hate that.,2
1993,l3nxckk,Nebetus2,1715484066.0,"No one cares at ours, so I'm pretty sure it's jot legal to do that.",1
1994,l3nzn2x,tray_cee,1715485279.0,"I'd ask your GM like ""hey just making sure this was normal?""",1
1995,l3o867i,woodman105,1715490183.0,UpdateMe!,1
1996,l3q38bu,Billwillbob,1715529309.0,"A few years ago, I went to a store in orlando during one of these drives in middle of day. Guy on microphone going up to each customer in checkout line pushing for donations and not taking no for an answer. It was a huge production so no way not everyone knew about it. I have a way of telling people no that makes it clear but the second hand  embarrassment i was getting off treatment of others being hounded was intense.",1
1997,l3qxdkg,DunKco,1715540802.0,RemindMe! in three 3 days,1
1998,l3rgq7j,trouteaser,1715548220.0,Corporate HR...  not right!,1
1999,l3shtj0,Monkeyfeng,1715564129.0,Wtf,1
2000,l3v66za,Livvy_NW,1715615497.0,At my warehouse they won’t let us shop after hours.,1
2001,l3vgfze,NickyBurnz,1715619052.0,Ok why would you post this on Reddit instead of using the Open Door Policy? Read your handbook my guy,1
2002,l3nt57h,Feeling-Nectarine,1715481937.0,"Of course it’s wrong but there is some clarity missing. Did you actually say no? Or was it a miscommunication? 

Keep in mind it’s against the handbook rules to purchase anything when you’re on the clock. Also after closing unless approved by a manager. The manager may have been saying “we don’t allow purchases at this time but if you donate to children’s we will bend the rules” 

I know many people make purchases at the end of their shifts but technically it’s against policy. Just because everyone does it doesn’t make it right. Keep that in mind if you go up the chain to report the person. You were also in the wrong somewhat. I do agree it’s wrong to do this to employees, but you should be making your purchases when the store is open and you’re on break.",-3
2003,l3o2j5s,schmittyb99,1715486863.0,I am the CEO. I WILL TAKE CARE OF THIS.,0
2004,l3pp8vj,Salty_Warthog,1715523805.0,it was also the night that the skeletons came to life,0
2005,l3oyv5x,SnooPandas1899,1715509786.0,"How do they charge that?  Is there a specific UPC code?

Something didn’t add up.  

Pun not intended.",0
2006,l3pgin2,GottaUseEmAll,1715519982.0,"I don't think they have any obligation to allow you to shop after hours, so I'm sure it's legal for them to add whatever condition they like to allowing you that.",-5
2007,l3prd0a,Califaith21,1715524672.0,Why would you post this?,-9
2008,l3omipv,sonia72quebec,1715500294.0,You can buy stuff after hours at your warehouse?,-1
2009,l3p5prq,Aware-Protection-697,1715514315.0,Talk to your union too if your store is union,-1
2010,l3o7eqi,LaxSyntax,1715489713.0,Never work for a manger.,-2
2011,l3s0pot,Mindless_Rip8599,1715556582.0,MAGA,-3
2012,l3oti2c,SmaII_Cow__________,1715505688.0,Just do your shopping during your lunch break,-6
2013,l3rfsno,Long_Cause_9428,1715547851.0,"Tills aren't supposed to be re-opened after close, I'm pretty sure it's actually in the employment agreement that employees are only allowed to buy product during opening hours and while they're off the clock.

The manager is actually doing you guys a favor.  If you don't like it, buy your shit when you're supposed to because if you complain the manager will get a slap on the wrist and NOBODY will be able to buy stuff after close.",-6
2014,l3psd69,Kimberoutlaw,1715525044.0,Don't shop after hours.,-8
2015,l3ob2ji,brOwnchIkaNo,1715492059.0,"Is only $10, relax buddy.",-15
2016,l3nhfja,koei19,1715476431.0,"That's fireable, right?  Like, no question, this guy's getting fired.

Edit: ""fireable,"" not ""fire-breathing.""  Auto correct",1121
2017,l3pkrok,Trick_Figure2512,1715521863.0,"If this doesn't go anywhere, you need to contact the RM and HR.",11
2018,l3nmm8n,Tvp125,1715478834.0,There may be a miscommunication here. Assuming the manager was just trying to raise money for CMN (which is all they care about in May) he may have said that as a joke. Maybe he misunderstood your laughing as a yes okay. (You didn’t say no?). I would talk it over with your AGM and simply get a refund. Also… always check your receipt before you leave. Employee or not…,63
2019,l3nd91a,sfyubcdetjiivdseg,1715474512.0,"This. The percentage of the $10 will be different state to state but legally, it can be as much as 85%/15%. It’s not right by any means but doing the right thing and doing the legal thing doesn’t always happen. GM will be the best approach.",398
2020,l3nwt2g,The_Original_Gronkie,1715483784.0,"I was thinking the same thing. These charities often give cash bonuses to the top producers, and top producers are also are more likely to get promotions and raises. This guy may be using this to rise through the ranks, on the backs of those he supervises.",98
2021,l3nxg77,HernandezGirl,1715484120.0,"That’s why I said, “What an A hole”",22
2022,l3nxbmv,TheDarkCobbRises,1715484053.0,"Donations are a tax write-off. So, yeah.",-18
2023,l3nnal5,Tvp125,1715479152.0,"There are so many people involved in CMN fundraising. This one manager is not going to get a special “status”.  Everyone automatically jumps to the absolute worst case scenario. Extortion. Really?

Could the manager have been more clear. Yes, is it possible the employee didn’t give a clear response (laughing). Yes, I’m willing to bet this is just a misunderstanding. 

CMN is a huge focus for Costco but at the end of the day we as employees do not get anything out of it other then a feel good that we raised what we did as a whole.",-83
2024,l3nno8p,Tvp125,1715479328.0,Start with the GM. The ethics or whistleblower site just forwards it off to your warehouse manager to handle. Unless it is about your warehouse manager.,211
2025,l3nm1px,jarede36,1715478564.0,"Oh, trust me. Not a single thing will happen to their employment status.",-6
2026,l3nbgtf,HankenatorH2,1715473706.0,But it’s not: it’s a long white receipt with a smiley face drawn on it !,116
2027,l3rgab0,Long_Cause_9428,1715548045.0,"You realize the OP buying stuff after close is also voluntary, if they don't want the add-on, they can buy their stuff when the store is open like they're suppose to.  The manager is actually doing them a favor because tills aren't suppose to be reopened after close.",-8
2028,l3qik4h,DunKco,1715535133.0,this is absolutely the best course of action.,3
2029,l3sxjhm,mbz321,1715571357.0,"That's a common misconception, but that's simply not the way it works. Now, Costco donates a certain amount themselves which they can write off, but they can't legally write off your donation. Technically, you could save your sales receipts and claim it on your taxes if you wanted to...Costco, and corporations, cannot.",1
2030,l3rhfej,Long_Cause_9428,1715548494.0,"Members aren't allowed in the store after hours, so no, you're not just a customer like everyone else.  You are an employee who wants a manager to break the rules for them.",-1
2031,l3ns5wl,Masherbakerboiler,1715481465.0,Yes! An update please OP. And let’s hope every employee who ever purchased after hours under this tactic who got hit with that $10 gets looked up in the system history and refunded that cash for every single occurrence.,9
2032,l3rgz8h,Long_Cause_9428,1715548320.0,"So, as a lawyer, you're saying it's illegal for a manager to require a $10 charity add-on if an employee wants to buy something when the store is closed?  Even if the option is open for the employee to buy what they want during open hours without the required add-on?",1
