,ID,Author,Time,Comment,Score
0,l2i4nbi,CookieButterLovers,1714799621.0,"**May 2024 Hot Buys - Valid May 4 to 12, 2024**  
[https://www.costco.com/warehouse-hot-buys.html](https://www.costco.com/warehouse-hot-buys.html)

**Current Coupon Book is still valid until May 5, 2024**  
[https://www.costco.com/online-offers.html](https://www.costco.com/online-offers.html)

**Next Coupon Book possibly starting on May 15:**

[Costco Monthly May 2024 Coupon Book Member-Only In-Warehouse & Online Savings Valid May 15, 2024 - June 9, 2024](https://www.reddit.com/r/Costco/comments/1cm1rb8/repost_costco_monthly_may_2024_coupon_book/)",1
1,l2jqc35,edwardfortehands,1714832943.0,Where is the new coupon booklet? I’m starving,23
2,l29r9ga,KiteIsland22,1714669632.0,When does Costco release the coupon book?  The current sale ends May 5th and I haven't seen the new coupon book published anywhere.,10
3,l28uo92,stonecats,1714658366.0,"nyc, item# 385892  
famous dave's sweet 'n spicy pickle chips  
64oz now thru 05/26 sale price $5.69

*i got these before, and found them really good    
however the jar has a lot more juice than chips    
so a good idea may be to remove all the chips to    
another jar, then use the juice to pickle more of   
your own veggies.*",3
4,l2qu663,jmcookie25,1714945392.0,What are the chances of the Kirkland diapers going on sale for this next cycle? Or would they not do that since the Huggies are on sale now (ending today)?,4
5,l2vabuv,Ok-Vermicelli6704,1715021516.0,Northern California here. Has Costco completely dropped the Maple Leaf Farms Canadian Bacon? It was my wife's particular favorite (native Canadian). Costco had it for years and then...poof.,4
6,l2atlcc,CookieButterLovers,1714682434.0,"Looks like Underwood Sriracha is available in more regions outside of California.

Same Day link - [Sriracha Chili Sauce, Item 1768166](https://sameday.costco.com/store/costco/products/40943667)

https://preview.redd.it/0uiheyv3r2yc1.jpeg?width=600&format=pjpg&auto=webp&s=aa17b51a8a79e4e5d73cf92c336ddb686b22fe6a",3
7,l2g8zgw,dlwowns,1714769579.0,"for the Costco Kirkland brand shoes, Does anyone know if these are in warehouses? or only via online?",3
8,l2kvjre,fdjadjgowjoejow,1714847469.0,CeraVe Moisturizing Cream 19 0z. When was the last time (month?) this was included in a coupon book? TIA.,3
9,l23f1kz,edwardfortehands,1714572594.0,Does anyone know how often they do new travel deals? Specifically looking for Italy,2
10,l245k84,Icy_Entertainer_4220,1714581869.0,"Does anyone know what the seasonal cupcake offering currently is?  Last month was carrot cake, wasn't sure if that's still available or has been replaced with something new.",2
11,l2b33at,smokybbq90,1714685812.0,Is there a way to add an Avis # to an existing CostcoTravel Avis car rental?,2
12,l2cwgg6,spilled-chili,1714714085.0,Anyone have any idea what happened to the Kirkland Signature brands of bourbon? I haven’t seen them in months… is it just a local thing?,2
13,l2nri2j,wizpig64,1714895044.0,"at the Issaquah warehouse saturday i saw these deals of note:

- bibigo korean style chicken was 10.79 after a 3.70 rebate until 5/12
- pappalo's pizza rolls were 13.99 after -4.00 until 5/19
- ore-ida extra crispy ""fast food"" fries were in the freezer but had no price tag, so i didn't grab any. this is the first time i've *ever* seen french fries at costco though so i figured it was worth mentioning.",2
14,l2vfuk0,angrymare1234,1715023414.0,Is Good Culture cottage cheese no longer carried? MN locations have been out and I was told last week it’s been deleted from the system.,2
15,l2xnbyt,Chrushev,1715054548.0,"Last few trips they only had the regular size beef hot dogs (black package) but the blue package long ones are nowhere to be found. There wasn’t a spot for them either so not like they sold out.

Online says not in stock either. Anyone know what’s going on?",2
16,l318bik,mayhem_x,1715114435.0,"I'm trying to figure out when these wines; Kirkland Signature Bordeaux Superieur and the Kirkland Signature Gigondas are available to buy, like which months specifically they generally are for sale.

Kirkland Signature Bordeaux Superieur, item number:**1184548**, $6.99

Kirkland Signature Gigondas, item number: **1134102** , $13.99

I'm located in Charlotte, NC - SE Region. 

They're both sold out at my location and I wasn't sure if there were specific months they're available so I can be on the lookout for them.

Thank you for any help you can provide!",2
17,l32b0l8,luckyfetish,1715129065.0,I hate the rule of posting in this thread because I feel like it just gets lost. But I’ll shoot my shot… does anyone know if Costco quit carrying hint water? And also quit carrying June shine? 🙏🏽,2
18,l38j5or,ConstelationFace,1715227643.0,"I just posted this as a thread and it got removed :L Anyway. Does Costco ever carry digital cameras?

I’ve looked on the website and see they have cameras in security systems, but I’m looking into purchasing a digital camera for recreation sometime in the future and was wondering if I could hold out for a good deal from Costco. I swear I’ve seen them in stores in the past but maybe I’m mistaken?",2
19,l3cutwz,Riverwidgets,1715297361.0,"Does your costco have adderall shortage? I'm a member but never thought about their pharmacy. All around every pharm is always at a shortage, is costco's standard higher? Very sure they accept Medi-Cal. Do you also have to be member?",2
20,l3dotx1,Tenkawa10,1715310019.0,Does Costco still carry it? I went two weeks ago to buy the 4 pack of Italian sausage but it looked like it was sold out. I went back today and the price tag isn't even there anymore. Did they stop carrying it? I'm in the L.A. Region.,2
21,l2phzc8,emcarlin,1714927617.0,"There is a Costco in Maine, pls update the map ",2
22,l2re2mk,ComplexClock,1714953633.0,Anyone buy the Sunforce Solar String lIghts for $30? Are they waterproof for outdoor rain?,2
23,l25e8t9,ptran90,1714597091.0,"Is the sweet heat snack mix gone?? - Austin and San Antonio, TX",1
24,l25j7kc,djbeaker,1714598836.0,"Any idea when, if ever, the vintage weather proof socks will come back? 🤐",1
25,l26novu,millerhighlife,1714614721.0,"Does anyone know what part of the store the designer perfumes are usually in if they are in stock? I know it's only a few times a year and they might be in stock now because of Mother's Day. My local Costco is in Grandville, Michigan. TIA!",1
26,l276iaq,little-asskickerr,1714623120.0,Will the quest 3 bundle ever be in stock?,1
27,l2atfyp,djaman0589,1714682383.0,I thought I saw crab legs but now am only finding whole crabs in the stores around me. Do you see crab legs where you are or am I not remembering right?,1
28,l2guleu,riciidbdhifieb12,1714778067.0,Anyone having Kirkland brand formula shortages? We are out with no ETA when it will be back. In northeast,1
29,l2hkn0p,laurenrj6486,1714789387.0,"Are Nutribites beef liver dog and cat treats done?! They’ve been in club for YEARS and I went today because we’re out and they were gone. I almost started crying in Costco - it was a rough day. They’re still on the website so I ordered four bags, but if I can’t keep these in stock, I’m afraid my dogs will eat me 😕",1
30,l2i1fmo,KDR2020,1714797766.0,32 Degrees Men's Air Mesh Tee 4-pack are these still available?,1
31,l2k7esc,jimmyvluv4u,1714839176.0,Has anybody else’s Costco had skim milk go missing? Ours (Northern Virginia) has not had it for well over a month at this point.,1
32,l2odfb6,Necessary-Treacle-43,1714910587.0,Does anyone know when the Schiff brand Move Free will be on sale in Michigan?,1
33,l2pvyki,Alwayswonderingwhy1,1714932635.0,Does anyone know when Cheese Whisps will be back?,1
34,l2vvu9r,rich_brook,1715028901.0,Anyone know if the 22 inch Blackstone griddle will come back in stock?,1
35,l2za9rh,The_lolrus_,1715089822.0,"Is the Kirkland fat-free organic greek yogurt gone for good? It's spot in the shelves at my local costco has been completely replaced with other goods and nowhere to be found. I live off that stuff, will be a bit sad if it is gone for good...Colorado area",1
36,l30hur3,Berzerkly,1715105278.0,"I went to the San Leandro Costco yesterday and they didn't have the poppy seed muffins in stock. Anyone know when they'll be coming back? The bakery said they'd return but didn't know when. Do any other costcos in the bay still carry them? Or is there somewhere else I can get the same or similar?

Thanks!",1
37,l3157ip,SnarkyIguana,1715113368.0,"PNW/Seattle area friends, has anyone seen King Arthur bread flour? I haven't seen it at my Tukwila location and the website's search feature is less than helpful lol",1
38,l325w4h,amygdala_activated,1715127018.0,"Any idea why outdoor playhouses just disappeared off the app/website? I was looking at one yesterday morning, and when I went to show it to my husband yesterday evening, it was gone, along with the entire category for it. (It was under Patio, Lawn & Garden -> Backyard Playground Sets -> Playhouses.) Any chance they’ll come back?",1
39,l331g9y,COBirdGrrl,1715140275.0,"Island way sorbet—gone for good? 

Went to Costco yesterday bc it’s the season for Island Way Sorbet. They told me it has been deleted from their system! My family is devastated! Anyone know what’s going on?",1
40,l370uzt,Zealousideal-Ad-1720,1715205215.0,Does anyone know if the Kirkland Signature  men's tech stretch pants are gone for good?,1
41,l377vaa,Allpiprosefl,1715207850.0,Did Costco stop selling Rodelle baking cocoa in store? It’s only available online. In Houston texas. Thanks,1
42,l3cmc50,SpeedSaunders,1715293991.0,"Has Costco stopped selling Kirkland aluminum foil? None on the shelves today, location is Northeast region (Northern Virginia)",1
43,l3gpg0q,leedav11,1715363888.0,Does Costco have miter saw anywhere? I live in MW region and i've not notice anything this year yet,1
44,l3gpk3x,utopianexile,1715363934.0,"Did they stop stocking the 32 Degrees Cool Men's brief? Arundel Mills, Maryland",1
45,l3gsmky,Uncle_Antnee,1715365145.0,"https://preview.redd.it/ynt6va445nzc1.jpeg?width=650&format=pjpg&auto=webp&s=29de3a4fbdf9135952cba6ec658d34de4a125ca9

The Costco’s around me (Utah) have stop selling these ""Natural Benefits Guava Lemon Green Tea"" I was wondering if it’s just around me or have they stopped selling them at all Costco? Any help would be appreciated.",1
46,l3gvwa3,brazil201,1715366331.0,"Anyone else costco no longer have the kirk SUPER SIZED PEANUTS? 

i'm in Jersey",1
47,l3kdbvy,pumfr,1715429813.0,"Kirkland Signature Nature's Domain Small Breed Salmon and Lentil - is it discontinued?

Tried to pick up a bag of this (Item #1193179) this afternoon at the Sun Prairie, WI location, and it was missing from the dog food section.  I asked about it; the employee said it wasn't in the system.  I called to another location across town (in the Verona, WI), and they, too, said it wasn't in their system anymore; they suggested maybe they were revamping the packaging/etc., but that they couldn't check stock at other locations since it's no longer in the system.

Does anyone have an inside scoop on the fate of this?  Is it only in this region that it's gone?",1
48,l3kl1gk,--Randy-Lahey--,1715433649.0,Has anyone seen Hilo chips in their local Costco recently? Is this now a deleted product?,1
49,l3kq4ic,merkhet,1715435942.0,Anyone know if the Caphalon Stainless Steel Space Saver set is ever coming back? Haven’t seen it in a while… (DFW),1
50,l3mb5gq,CrackHeadRodeo,1715458780.0,Are the Loves Organic beets discontinued forever?,1
51,l3nr4q8,OnePineRoad,1715480963.0,Did they discontinue the Tuscan Mariana Sauce? It was my favorite :(,1
52,l3nt5ab,AwwYeahVTECKickedIn,1715481938.0,"I'm absolutely addicted to the **St Michele La Grande Galette** cookies. So much so, that I've emptied stock of every us importer I can find via Google, and my stockpile will not last me terribly long. I cannot get a firm commitment on whether these smaller ma and pa shops will restock anytime soon, and I'm getting a bit nervous!

I know that these have been seasonal at Costco for years, although I first discovered them last holiday season. My question: for those that have been at this awhile, when do you typically see them show up? Is it like the last quarter of the year (Oct-Dec) or might I get lucky and see them a bit earlier? Do you only see them at the holidays or do they sometimes make a return at times throughout the year?

Thanks in advance for any info you can provide!

Sincerely, a French butter cookie addict.",1
53,l3qtk85,jandb19,1715539335.0,"With the new M4 iPad being released on May 15th. Will they be available for in store purchases that day or will they be shipped to the store starting on that day?

On the 15th can I walk in and purchase?",1
54,l3ri564,zerostyle,1715548776.0,"Best healthy / lower carb dry foods people recommend from costco? Things like nuts, protein bars, jerky, etc?",1
55,l3v4wn2,empathetic_witch,1715615047.0,"Kirkland Women’s Pima Cotton V-neck T-shirts ? I live in the Seattle area and so far 1 warehouse just had crew neck. Still nice quality but I purchase stacks of the v-neck black (and if the other colors aren’t pastel) every year. 

I did pick up a couple black crew necks to try & one dark green.",1
56,l3v5il4,davidlovepandles,1715615261.0,Anyone know about how often PlayStation store gift cards go on sale for $80? Been watching for ages and looks like the last one was over a year ago ,1
57,l23r43b,SloppyDuckSauce,1714576939.0,Asking again for this month: has anyone seen the kirkland margarita mix in the Northeast region yet?,1
58,l24mdts,hazlos,1714587563.0,Are the ribeye caps coming back ever?  I think it was PN 15151. Also in the NE region.,1
59,l2plxzm,CookieButterLovers,1714929011.0,"[Hot Buys](https://www.costco.com/warehouse-hot-buys.html) was posted Friday and is valid 5/4 until 5/12, so I'm guessing that the new Coupon Book probably won't start until Wednesday, 5/15?  

Based on that, my guess is that we'll probably see scans for the new Coupon Book sometime between now and Monday or Tuesday. 


Historically people usually get it in the mail on the Monday about a week and a half prior to the next sale period starting and will post images or scans the same day.

Costco hasn’t been posting it until day off lately.",4
60,l2y2jr7,CookieButterLovers,1715063852.0,"[Costco Monthly May 2024 Coupon Book Member-Only In-Warehouse & Online Savings Valid May 15, 2024 - June 9, 2024](https://www.reddit.com/r/Costco/comments/1cm1rb8/repost_costco_monthly_may_2024_coupon_book/)",1
61,l2i3wyu,CookieButterLovers,1714799185.0,"Costco used to post online previews for the next Coupon Book, but seems that recently they haven't been adding it online until the day that the Coupon Book starts.

But it usually gets mailed out about a week and a half before the new sale starts and people will take pictures or scan it and put it online about 9 days prior. 

Since [Hot Buys](https://www.costco.com/warehouse-hot-buys.html) was posted today, Friday 5/3, and is valid 5/4 until 5/12, I'm going to guess that the new Coupon Book probably won't start until Wednesday, 5/15? 

So I'm guessing we'll probably see scans sometime between now and Monday if the pattern follows. 

I tried to see if there was any pattern with previous Coupon Book dates and when they were shared online (prior to being uploaded on costco.com):

* Friday 3/29/24 for 4/10/24-5/5/24 - 12 days prior
* Monday 2/26/24 for 3/5/24-  3/31/24 - 7 days prior
* Monday 1/22/24 for 1/31 - 2/25 - 9 days prior
* Monday 12/18/23 for 12/27/23 - 01/21/24 - 9 days prior
* Friday 11/10/23 for 11/20/23 - 12/24/23 - 10 days prior
* Friday 10/20/23 for 2023 Holiday Savings (10/30/23 -11/27/23)
* Monday 10/16/23 for 10/25/23 - 11/19/23 - 9 days prior
* Monday 8/21/23 for 8/30/23 - 9/24/23 - 8 days prior
* Saturday 7/22/23 for 8/2/23 - 8/27/23 - 11 days prior
* Thursday 6/15/23 for 6/21/23 - 7/23/23 - 7 days prior
* Monday 5/8/23 for 5/17/23 to 6/11/23 - 9 days prior
* Monday 4/3/23 for 4/12/23 to 5/7/23 - 9 days prior
* Monday 2/27 for 3/8/23 to 4/2/23 - 9 days prior
* Tuesday 1/24 for 2/1/23 to 2/26/23 8 days prior
* Wednesday 12/21/22 for 12/28/22 to 1/22/22 - 7 days prior",14
62,l2be1v7,ravensfan8484,1714689954.0,"Also curious about this - I mainly shop at costco for the food deals and the current ones are so lame to me,  could not be more excited about a new coupon book arriving soon!",1
63,l2w7n4i,Sad-Fix1813,1715033169.0,Sure as hell hope so. I’m buying 10 boxes (2 at a time of course) next time they do,1
64,l2pfd5d,CookieButterLovers,1714926658.0,"Already answered your other post that CeraVe was last on sale in February in the U.S. (January for Canada), but FYI - it was 2-pack of 16 oz tubs, I’m not familiar with a 19 oz. jar. at Costco.

This one - [CeraVe Moisturizing Cream Interchangeable Multi-Pack, 16 oz Jar with Pump + 16 oz Jar](https://www.costco.com/cerave-moisturizing-cream-interchangeable-multi-pack%2C-16-oz-jar-with-pump-%2B-16-oz-jar.product.100778338.html)

https://preview.redd.it/ok89vw0exmyc1.jpeg?width=680&format=pjpg&auto=webp&s=b16dd69bb6dd932816661a83c923e1111f27d3bf",1
65,l24i5io,StOnEy333,1714586109.0,A new travel guide is issued in the spring and fall. Online offers are changed a little more frequently. The best thing to do is call and speak to a representative. They can build a specific trip you’re looking for. The packages you see offered are not the only things available.,1
66,l25zgv2,CookieButterLovers,1714604989.0,"The [Kirkland Signature Mini All American Chocolate Cakes](https://sameday.costco.com/store/costco/products/25527466) are back in some warehouses, but I haven't seen them locally yet, so your mileage may vary.

https://preview.redd.it/blkzqs5xcwxc1.jpeg?width=600&format=pjpg&auto=webp&s=6c6bdd7749a06810e776c95cabc627c5c05ea649

We still have the Mini Carrot Cakes with Cream Cheese Icing.",2
67,l2pkwov,CookieButterLovers,1714928658.0,"Thank you for sharing the fries, I know some people have been looking for a warehouse option.

[Ore-Ida Extra Crispy Fast Food French Fries](https://sameday.costco.com/store/costco/products/282111) \- looks like price varies by warehouse but they’re under $10 ($9.39 or $9.49).

https://preview.redd.it/1886mmqy2nyc1.jpeg?width=600&format=pjpg&auto=webp&s=85a3fe0b25fe056acfcfe1a41c9347d5a5386f91",2
68,l2orp5d,LoveOfSpreadsheets,1714917482.0,"So, some notes on the fast food fries.


  1. They're the best I've ever gotten out of an air fryer. I used to get them from Walmart, we are hooked on them


 2. You're right the Puget sound never used to have fries except the business centers, but AZ definitely had fries when I lived there (crinkle cut not fast ",1
69,l2ywb6w,mh1357_0,1715083827.0,"Well, I have bought the regular sized one before and they're probably the best beef hot dogs I've ever grilled. So it's not a bad substitute, especially for the price of $15 for 3 packs of 12",2
70,l33jjzc,CookieButterLovers,1715151504.0,"The [Kirkland Signature Beef Dinner Franks](https://sameday.costco.com/store/costco/products/19232554)?

https://preview.redd.it/rfw9cruyh5zc1.jpeg?width=600&format=pjpg&auto=webp&s=b2b84f4e1fb8d259ff84928dfcedf737bff6e066",1
71,l35gn9j,Lost_Horizon,1715186039.0,I'd love to know this too. Raleigh -SE Region,2
72,l32nla0,deathbyhoney,1715134125.0,i was just at my costco about an hour ago and they had hint water. midwest here 👋🏼,2
73,l35y1x0,dirtyundercarriage,1715191988.0,I just bought Hint the other day in the NE.,1
74,l3irpte,candycookiecake,1715393440.0,"I thought they did too, or maybe it’s just a Mandela effect 🤔 Digital cameras might be too niche of a hobby item these days since most modern cellphones have pretty great cameras.",2
75,l2pjw88,CookieButterLovers,1714928304.0,"The map is from Costco.com.

As of today, Costco still hasn’t updated their regional map to include Maine yet, despite the Scarborough warehouse opening in November 2023.

https://preview.redd.it/uoobwnfb2nyc1.jpeg?width=1179&format=pjpg&auto=webp&s=5e47f56408f6e774ec4ef8d55c6d2512bacde3fc",2
76,l25yvlv,CookieButterLovers,1714604750.0,"Yesterday somebody posted that they asked their local warehouse and they were told that the Sweet Heat Snack Mix has been 'marked for deletion'.

Post here - [Sweet Heat snack mix going away?](https://reddit.com/r/Costco/comments/1chc9mh/sweet_heat_snack_mix_going_away/)

Hopefully they bring it back ""seasonally"".",2
77,l2l9l2l,run__rabbit_run,1714852426.0,"at my store, it's near the pharmacy by the supplements and personal care items (shampoo, razors, etc). They have a lot of designer perfumes online right now!",1
78,l2evwro,SamaritanDecima,1714751364.0,(NE region) Have both king crab legs / dungeress cooked crab then frozen. In the seafood open refrigerators.,1
79,l2j67fq,BaileysButtercream,1714824442.0,"Maryland, have seen formula this week (Kirkland ProCare, blue tub).",1
80,l2k8zkj,Basic-Conclusion-461,1714839724.0,"I'm in MN. We don't even have a spot on the shelf for it in the store we usually go to but an associate was able to give me two nearby locations that have it in stock, HOWEVER, she also said to stock up (limit is 2 though???) because there is none on order :/. I did find it came into stock online briefly so I ordered one there too.",1
81,l2l96m6,run__rabbit_run,1714852278.0,I ordered some online last week and just got a shipping delay notification :( I'll be so sad if they no longer carry them! Our pup loves them so much.,2
82,l2pyydv,rubygoes,1714933744.0,Cave Creek AZ had the pepperjack/asiago Whisps in stock today!,1
83,l33hw67,CookieButterLovers,1715150322.0,"Not available at the Tukwila warehouse but try this link if you want to check other warehouses: 

[King Arthur Unbleached Bread Flour - Item 1604792](https://sameday.costco.com/store/costco/products/26952078)

Here’s the AP link just in case as well:

[King Arthur All-Purpose Flour - Item 1375333](https://sameday.costco.com/store/costco/products/20164286)",1
84,l33hibl,CookieButterLovers,1715150047.0,"Does this link work for you?

https://www.costco.com/outdoor-outdoor-play.html",1
85,l35xyeg,dirtyundercarriage,1715191955.0,"It is still available in the NE, I wonder if we will eventually get the death star.",1
86,l377wpp,Allpiprosefl,1715207866.0,Just saw in houston texas,1
87,l3hfjva,CookieButterLovers,1715373447.0,">Went to Costco yesterday bc it’s the season for Island Way Sorbet. They told me it has been deleted from their system! 

Can you please share which region you're in? Asking as products can be deleted in one region, but still available in other regions. 

Island Way Sorbet seems to still be available in all West Coast regions (I checked PNW, Bay Area, Los Angeles, and San Diego).

Here's the Same Day link - [Island Way Sorbet, Variety Pack - Item 502616](https://sameday.costco.com/store/costco/products/241313)",1
88,l3hgpbp,CookieButterLovers,1715373870.0,"I've never seen this product locally, which region did you find it in?

PS - Friendly reminder to please edit your comment to include the item name (Natural Benefits Guava Lemon Green Tea) as it helps with search results. 

Often times I'll notice a product that I remember somebody asked about is back in stock, but if they didn't include the product name in the text, I can't do a Reddit keyword search and won't be able to find the original comment to update that person that it's back in stock.",4
89,l2clh2p,DocAtDuq,1714708040.0,My Costco in the Midwest has these stocked,3
90,l2i64z8,KiteIsland22,1714800541.0,Wow thanks for the detailed response!,7
91,l2hlror,SenseiRaheem,1714789900.0,"I'm relatively new to Costco, but I feel like all of my deal books for the last 6-8 months have been super lame, and mostly about discounted nutritional supplements. A few years back, were the booklets better?",3
92,l2i45ys,CookieButterLovers,1714799334.0,"[Hot Buys](https://www.costco.com/warehouse-hot-buys.html) was posted today and is valid starting tomorrow - 5/4 until 5/12, so I'm guessing that the new Coupon Book probably won't start until Wednesday, 5/15?

Based on that, my guess is that we'll probably see scans for the new Coupon Book sometime between now and Monday. But I could be wrong.",3
93,l2rr69w,Conscious_Chapter_62,1714959354.0,"Totally agree. I really wanted to go last month but it is a bit of a drive for us and there were zero good deals in the ad that we wanted, so I didn't want to waste a trip on that month. I'm sure hoping May is better.",2
94,l2y2kvq,CookieButterLovers,1715063875.0,"[Costco Monthly May 2024 Coupon Book Member-Only In-Warehouse & Online Savings Valid May 15, 2024 - June 9, 2024](https://www.reddit.com/r/Costco/comments/1cm1rb8/repost_costco_monthly_may_2024_coupon_book/)",1
95,l2w81aq,jmcookie25,1715033318.0,Yeah I'm gonna buy a bunch too. I use the WHO growth chart calculator to see what my baby is expected to weigh every month (her percentile has stayed extremely consistent so far). Then I'll buy the number of boxes I need of that size to get be to ~1 pound less than the max weight.,1
96,l2pg5v6,fdjadjgowjoejow,1714926952.0,"> Already answered your other post

Thank you.",1
97,l378h4o,followthelogic405,1715208089.0,Are they better than Hebrew National?,2
98,l39ul5z,leninsballs,1715258192.0,"Not the OP, but yeah, I've been to two Costco over the last two weeks and I haven't seen these at all. Not only out, but there isn't even any pricing information on them.",1
99,l32or7j,luckyfetish,1715134597.0,"Okay, I’ll remain hopeful then. My Costco (Maui) hasn’t had hint water in 4-5months 😖",1
100,l25zhm0,ptran90,1714604997.0,Nooooooooo. Thank you. I didn’t see that post.,2
101,l2lat72,millerhighlife,1714852885.0,Thanks for the info! :),2
102,l2mfwua,laurenrj6486,1714869283.0,Oh no… now I’m really worried 😟,1
