,ID,Author,Time,Comment,Score
646,l3sg6y0,ragby,1715563409.0,It’s kinda fun if you crash into it and it makes a nice noise.,23
647,l3t5r2a,Snow-Dog2121,1715575878.0,"Same, I push them out of the way my cart and at that point I'm looking forward to the uneasiness.",5
648,l3svlwg,ALY1337,1715570398.0,Bumper carts trained you for adulthood.,6
649,l3tc8nb,daDiva64,1715580003.0,🤣,1
650,l3ugwpk,p90rushb,1715606086.0,"While yelling ""choo choo, muthafucka!""",1
651,l3uzigt,MariachiStucardo,1715613141.0,me too but I like to take a few steps back and get a real good head start,1
652,l3skh7g,Hard-To_Read,1715565310.0,I don’t use my cart or my hands. I’ve been arrested many times.,-11
653,l3t0jz0,No-Penalty-1148,1715572950.0,The offender probably thought the woman who said something was the one who was wrong.,17
654,l3ukloi,DifferentBandicoot27,1715607600.0,Good for her for not taking a picture and posting it to Reddit.,1
655,l3tpnpf,JMHorsemanship,1715590059.0,"I would have explained to her that no, keeping your cart on the left or right is in the way of the items. When you keep your cart in the middle, you can freely look at and get the things you need.",-4
656,l3tyxz3,strikeandburn,1715596880.0,Let’s make cart horns a thing.,1
657,l3tlqht,Dancingskeletonman86,1715586941.0,Also I'm going to say something that might piss off parents but baby or kids won't get killed because you walked into the produce cooler with them for a few seconds  to one minute to grab a spinach salad kit and a pack of berries. Really it's okay especially if the kid or baby is clothed as they should be. Especially when it's a baby and it's usually wearing several layers plus a blanket over it in the car seat. Really it's okay you can just push the cart into the cooler room for one minute or less to grab your thing. I have to contain my desire to laugh at the dramatic parents/grandparents I see who are like oh no honey noooo! Don't take the baby or kids in there it's chilly. Lets be less dramatic shall we. The baby survives winter time in Canada just fine do you really think one minute in the produce cooler while fully dressed is going to hurt them?,13
658,l3sywfd,Low_Sprinkles_7561,1715572061.0,I like tossing a box of tampoons in their cart.,12
659,l3t1btj,CutthroatTeaser,1715573368.0,so you shop their cart?   That's amazing! 🤣,1
660,l3sbgb9,seviay,1715561349.0,Probably one of the clueless cart folks 🤐,57
661,l3sac40,pb_lemon_toes,1715560876.0,"That's insane, isn't it? Reddit is wild. Sometimes I wonder if it's the ""I shouldn't have to have an interaction with another human being when I leave my living quarters"".",21
662,l3sfzg1,gigibuffoon,1715563316.0,Probably someone who thinks that touching others' cart is a big violation regardless of the situation,11
663,l3swzw3,ChartInFurch,1715571081.0,Someone complained about a random user's votes lol,4
664,l3t2vex,TJSwoboda,1715574226.0,"It's at +744 now, but Reddit will downvote a comment as soon as read it.",1
665,l3u9up1,ratshack,1715602893.0,"“Look, it’s the next contestant in our ‘Find The Cart!’ game!”",5
666,l3u9qza,MiniTab,1715602842.0,That’s a great idea. Put some random shit in it too.,1
667,l3utqgn,Aspen9999,1715611055.0,"This is why my husband can’t take me to Costco. I’ll drive their cart down multiple aisles. The more they have in their cart, the farther it goes. The more they already selected the less likely they are to just start over.",1
668,l3uyu3i,seviay,1715612899.0,Wow. I would love to say “I would’ve said ____” but I would’ve been so caught off guard by an NPC talking back that I would’ve been silent,1
669,l3vb1kf,bodhiboppa,1715617186.0,"This reminds me of the time that I had a very short amount of time to catch an international connecting flight in Charlotte. The first plane had landed late and the flight attendant told us to absolutely run to the departure gate. There was another guy who was running the same path and we both got on the moving walkway. There was a lady standing in the middle of the walkway with her headphones on and as the guy approached her he was like, “excuse me! Excuse me! I need to get through.” But she had her headphones on and didn’t hear him so he touched her shoulder to get her attention and she absolutely lost it and was like, “do not touch me! Use your words.” Like Jesus, you’re going to completely tune out your surroundings and then be surprised when someone gets your attention?",1
670,l3sky96,Impossibleish,1715565517.0,"Yup. I work there and did cart crew before my current department, so I know how they work lol.

Sometimes when I head to break I'll struggle in the most awkward way possible to move it to the side while apologizing or telling them I'll get fired if I don't make a fire lane down the center.",11
671,l3syqqg,seviay,1715571977.0,Hilarious,1
672,l3uyjq5,seviay,1715612795.0,How long are you lingering in Costco? 😅,1
673,l3uylr7,seviay,1715612815.0,Seems a bit aggressive and unnecessarily hostile,2
674,l3vgnwe,one_bad_rebel,1715619128.0,This baffles me. I see this at my local Costco all the time. It’s like Costco is their hangout spot.,1
675,l3tza4w,VestigialTales,1715597098.0,"Same on the ducklings!! I hate bringing my kids shopping at Costco because of their lack of self-awareness. “I’ll help by pushing the cart, Mom!” Nope. And when they walk beside it and start pulling it to the side so they can ride it like a scooter and I have to suddenly compensate to keep it from veering off, or walk in front of it and stop suddenly, or walk beside me and get in people’s way—my anxiety goes straight to a 13. Thankfully now they’re old enough to go look at the books while I shop. I get it and I’m sorry for our chaos.",27
676,l3ula8m,DisFigment,1715607866.0,"I used to work at a national retailer that had previously never had shopping carts since we didn’t really need them. Employees could just as easily help you to the front with the few very large items we kept on the sales floor. 

Needless to say, the carts turned into old lady stands and purse holders and rarely had products in them - normally more likely someone was going to run out with a cart full of stuff if they weren’t 60+ and female. The old ladies would walk around blocking aisles slowly with their empty carts and once they didn’t find what they wanted, they’d grab their purse and promptly leave with the cart abandoned in an aisle.",2
677,l3tq5qc,movdqa,1715590456.0,"Very common problem that I have when I'm running. I have to go on the street or figure out where the space will be between people that I can squeeze by without startling people.

Our indoor track has a walking lane and a running lane and half a lane outside and sometimes you get a couple and a baby stroller and every time you pass, you hope you don't crash. The use of the track is clearly posted but people want to walk side-by-side on the track.",9
678,l3t0rbh,be_someone_great,1715573060.0,"I only have one kid, and I totally get it. We can be a lot.. Mine is two and a half, and she just wants so desperately to do things independently that a lot of times we are probably in the way. I try to make note and move stuff so I can teach her the polite way. Just know I’d rather someone just pass us and I’ll apologize than people having to get annoyed at us!",31
679,l3u9gs4,Independent_Baby5835,1715602702.0,"We were at Universal not too long ago and this family of 4 decided to just stop and have a discussion between the exit and entrance lane and stand 4 wide, so no one could really pass by them. I nudged one of them with my stroller (I took my skinny stroller) and she had the audacity to say ow. I didn’t even apologize.",5
680,l3ucrpo,tiggahiccups,1715604262.0,"I give a fuck, that’s why I leave my kids at home. Otherwise my entire shopping trip no matter where we are is CONSTANT VIGILANCE. Get behind me! Watch out for that lady! Move over for that cart! Get back here! Follow me! Oh my god it makes me so stressed out. I leave them at home whenever possible.",2
681,l3unmu6,Chrissy325,1715608776.0,I'm a mom of a ten year old. I assure you I care and she will not act like a creep in the store. If it ever happened we left.,1
682,l3szgfe,BoardImmediate4674,1715572358.0,Bingo on this ☝🏼. I know this is Costco but they do the absolute same at Sam’s.,-1
683,l3tao9a,banned_but_im_back,1715578952.0,Idk that’s a bit micromanaging your kid making sure they walk here and not there. Kids Islam will move out the way. I just say excuse me and they move.,-1
684,l3taglp,joyeleanor,1715578811.0,"Lol! Entire clan, grandparents, neighbors everyone grab a cart each. What a mess!",9
685,l3tlibr,Milliemott,1715586764.0,For free samples 😔,6
686,l3u0eor,LivingtheDBdream,1715597801.0,This is the way.  Will anything be learned though?  Highly doubt it.,1
687,l3simr6,Maj_Histocompatible,1715564486.0,Nah they lost it when they entered the parking lot. People routinely drive down the middle of the lane in the parking lots at my Costco. And then wait there with their blinker if someone starts to pack up their car up to leave,78
688,l3sotry,WizardLizard1885,1715567211.0,i had my card in hand when im walking to the door..peopel magically forget they need their cards until the greeter asks.,13
689,l3sj5zn,HowellPellsGallery,1715564725.0,I honestly think it's because more affluent people shop there and affluent people are more likely to be rude and not care about others.,40
690,l3sp2vx,Zestyclose_Currency5,1715567323.0,Au contraire mon ami….it starts when they enter the parking lot….all rules and courtesies are dropped immediately upon arrival,5
691,l3sq652,Franklinricard,1715567805.0,Uggg when they stop the cart just inside the door and load their kid into the seat or put their card back.,1
692,l3upxx3,BrainOfMush,1715609650.0,Same thing at the airport… everyone checks their brains in at security.,1
693,l3t7mts,hgghgfhvf,1715577013.0,"Especially when you see the study on financial demographics of your typical Costco shopper. Meaning they’re typically a fairly well off (decently above average) income earner. 

Like really, do you need to act like a hungry dog over a single bite of some food that is sold in a $8 package? 

I rarely get samples, only when I’m actually walking by and nobody is around (which is rare, it’s always gone in an instant) but if whatever it is looks good I’ll just buy a box anyway. If I don’t like it oh well I’m out a little bit of money.",2
694,l3uwsc2,starter-car,1715612158.0,"Those free samples make them lose their goddamned minds.     I live in Utah, they’re the cheapest asses anywhere.   Something is free? They’re bringing the whole brood. And they just stop, whenever, wherever, just to grab that free sample.    Grrrrr!",1
695,l3vi2om,SwimmerIndividual510,1715619611.0,"Costco has such very wide people in those aisles that it cancels out the extra aisle space. Most of them don’t appear to be in the worker-bee cohort, yet live to be there on Saturday - rolling sooo slowly.",1
696,l3sh7x6,monstargaryen,1715563866.0,"The first week of Covid I caught someone trying to steal canned food out of my cart since the aisle was down only to the nasty cans. When I caught her she pulled the ‘Huh? What? Thought this was my cart.”

Then she walks back to her cart *that her kid was in*.

My canned shredded chicken that you didn’t select made you think my cart was yours but the lack of your child in mine didn’t tip you off? 🧐",26
697,l3smfnh,Dreaunicorn,1715566167.0,I may be crazy but I’ve never found the same type of assholery in my local Walmart than at Costco for some reason. ,8
698,l3v6fz6,aManPerson,1715615584.0,"it's so you can have real world flair when you get upset, walk up to them and say ""you're makin me (gestures, tossing things into the air), LOOSE MY MARBLES, when you do that""",3
699,l3stov3,myinternets,1715569452.0,"Some people are rude, yet others might be having a bad day. Maybe their spouse or parent just died. Maybe they just got a cancer diagnosis that morning. Who knows. You still have to eat when your life goes to shit. Maybe they're straight up mentally ill. Always better (and easier) to assume people aren't being rude on purpose.",-4
700,l3snb1w,rosyred-fathead,1715566553.0,Yeah I just continue my original trajectory lol,16
701,l3tkoym,RohanneWebber,1715586137.0,"1. Regular voice

2. Teacher voice

3. Cop voice",15
702,l3skraa,leostotch,1715565432.0,“I literally did have to yell!”,32
703,l3tqx3y,bomber991,1715591053.0,The secret is to just start coughing like you’re sick. Then everyone gets out of the way.,12
704,l3u8050,cranial_d,1715601972.0,"""You should have had on your listening ears.""

got to use that once. Then we must have been on the same shopping pace because I saw them multiple times going down the aisles. Stink-eye each time we passed.",1
705,l3sfofx,leostotch,1715563182.0,"Number three merited a raised voice, for sure. 

My impression was that they all thought I was trying to get the employee to stop helping them and start helping me, so I understand why they ignored me.",13
706,l3ssfhq,Responsible-One2854,1715568847.0,"No need to say it that many times. After a regular level “excuse me,” I’ll say it louder a second time. I’d still no response, they get a very loud, “YO! MOVE!”",6
707,l3sjfti,swalabr,1715564850.0,"at that point, the expression officially becomes, “Coming through— make a door and make it wide!”  as loudly as necessary",5
708,l3t601n,YummyArtichoke,1715576027.0,https://i.imgflip.com/8puupi.jpg,7
709,l3srxuf,malogan82,1715568615.0,"Well, I was looking for an excuse to upgrade, after all.",5
710,l3si78j,msb2ncsu,1715564297.0,We know…..,2
711,l3uxk1d,starter-car,1715612434.0,"Until you rounded the corner and lo, a second sample station, with clones of him.",1
712,l3t6aup,YummyArtichoke,1715576204.0,The internet would be pretty boring if we didn't automatically assume the worst about everyone based on as little info as possible to make that assumption.,-2
713,l3uexr7,rayquan36,1715605230.0,People really living out their fantasies on Reddit. They think they're the hero of the story and everybody else is a piece of crap. A car parks poorly? They deserve to have shopping carts ziptied to their doors because they're clearly the villain of the story.,-3
714,l3vjmga,sneakpeekbot,1715620149.0,"Here's a sneak peek of /r/iamverybadass using the [top posts](https://np.reddit.com/r/iamverybadass/top/?sort=top&t=year) of the year!

\#1: [Either a real warrior or just an alcoholic, i'm leaning towards second one](https://i.redd.it/qsxojbtkpnwa1.jpg) | [672 comments](https://np.reddit.com/r/iamverybadass/comments/131ppgq/either_a_real_warrior_or_just_an_alcoholic_im/)  
\#2: [Such an innocent little poke](https://v.redd.it/unl3qr4z3flb1) | [140 comments](https://np.reddit.com/r/iamverybadass/comments/1666obd/such_an_innocent_little_poke/)  
\#3: [Enough badass tats for ten badasses.](https://www.reddit.com/gallery/1br0i8c) | [1301 comments](https://np.reddit.com/r/iamverybadass/comments/1br0i8c/enough_badass_tats_for_ten_badasses/)

----
^^I'm ^^a ^^bot, ^^beep ^^boop ^^| ^^Downvote ^^to ^^remove ^^| ^^[Contact](https://www.reddit.com/message/compose/?to=sneakpeekbot) ^^| ^^[Info](https://np.reddit.com/r/sneakpeekbot/) ^^| ^^[Opt-out](https://np.reddit.com/r/sneakpeekbot/comments/o8wk1r/blacklist_ix/) ^^| ^^[GitHub](https://github.com/ghnr/sneakpeekbot)",1
715,l3v4yjk,xyrian328,1715615066.0,"Great thinking, you definitely don’t want the oblivious people reproducing.",2
716,l3v1r0e,Takarma4,1715613934.0,I mastered the art of shoulder checking folks like this.,4
717,l3uf3ks,rayquan36,1715605302.0,Wasn't that a COVID thing?,1
718,l3v31wj,Babyfat101,1715614397.0,Why?,1
719,l3t4c62,Moveless,1715575057.0,"We were all raised with the ideas, in America, that we are unique, and special, and deserve \_\_\_\_\_ (everything), and that we should be happy and entertained all the time. We are not raised as a community to care for one another. It's in the system... in the water. It's everywhere.",3
720,l3ukq3e,Substantial-Bad9267,1715607647.0,Great minds…,2
721,l3sllqf,Hard-To_Read,1715565804.0,"Sorry, I didn’t mean my tone to be accusatory. You sound like the kind of shopper we all respec.",0
722,l3uqs83,rayquan36,1715609968.0,"Yes, at Costco sometimes I see other people zone out and I say ""excuse me"" and each time they've been apologetic and moved their carts out of the way.",1
723,l3sl2ir,the_catmom,1715565569.0,I have never done drugs in my life but have a real disability,3
724,l3uiovo,afroturf1,1715606830.0,"Nah, the foul ancient white crowd.",0
725,l3u4ins,Crystal-Clear-Waters,1715600162.0,lol Nah.,0
726,l3uwvm3,plippyploopp,1715612191.0,Costco sub...... yall hangout in a sub about costco,1
727,l3slbec,Decent-Photograph391,1715565677.0,Ignore. They are trolling.,3
728,l3sliew,Ok_Share_5889,1715565762.0,I doesn’t just happen at Costco it happens in a lot of other store as well,-2
729,l3vf54m,Courage-Rude,1715618601.0,I get some extreme anxiety about the behavior of some in Costco lol. Always try to make it a once a quarter visit if I can.,5
730,l3uj8io,BeerSlayingBeaver,1715607053.0,"Interesting theory! 

Can I subscribe to costco conspiracies?",16
731,l3tcxqp,thelittleluca,1715580483.0,I’ve made this mistake at a Costco bc I thought people could get around me. Wasn’t the case.,1
732,l3v2saf,YouQueasy431,1715614303.0,Also the carts are so friggin huge,1
733,l3t0ud5,Rough_Principle_3755,1715573106.0,“THIS. IS. COSTCO!!!!”,33
734,l3sueg0,elfiludo,1715569800.0,I say A LA VERGA LO K NO SIRVE!,64
735,l3sqq7v,jaguaraugaj,1715568060.0,I say “AWOOOOGA”,39
736,l3t2nbj,Handlestach,1715574103.0,I have a son who often tells people they drive carts like dicks.,5
737,l3ttixk,LittleJohnStone,1715593084.0,"Gotta start bringing one of these bad boys with me

https://preview.redd.it/m31p5vz1z50d1.jpeg?width=1078&format=pjpg&auto=webp&s=83973fc6353754988fcedfccc3fb926553e7da9b",2
738,l3sj0wz,swalabr,1715564662.0,“Ope”,33
739,l3t4be4,game_over__man,1715575044.0,"My coworker’s uncle has a zero tolerance policy. Move, get out the way, or he plows the cart with his. I can’t believe he hasn’t been kicked out. But shit, it’s funny.",11
740,l3t6gsi,denny-1989,1715576304.0,"‘Oh sorry, I didn’t see your cart there blocking most of the doorway to the produce room’",12
741,l3t1rt7,boafriend,1715573619.0,"Some Costco goers lack all-around awareness, sadly.",2
742,l3sz5i6,goodvibezone,1715572196.0,Or condoms,4
743,l3vh4zn,DeezBeesKnees11,1715619291.0,Tampoons?  🤣😂🤣,1
744,l3si8ud,Drabulous_770,1715564316.0,Have common courtesy and people won’t move your stuff! ,12
745,l3sjm3t,sack-o-matic,1715564929.0,it's not yours if you didn't buy it yet,1
746,l3trc6n,where_in_the_world89,1715591385.0,"Lol one downvotr out of hundreds of people probably, gets a reaction like ""oh my God why is this happening!?"". I mean yeah it's annoying to get down voted for no reason, but at least wait until it's more than one or two before complaining people",3
747,l3uu8ap,Mr_MacGrubber,1715611235.0,Lol,1
748,l3uabt9,ATLFiggot,1715603122.0,">I’ll help by pushing the cart, Mom!

Omg this is the worst. It’s always on Saturday and Sunday where people are like “awww little Johnny is pushing the cart and taking up the entire aisle. Isn’t it adorable?”",13
749,l3uprkj,baronmunchausen2000,1715609585.0,"Pet peeve #3. People getting their 10 year old to push a heavy cart, which the kid is struggling to control.",1
750,l3tabg5,In-it-to-observe,1715578720.0,You are not the problem. People lack self awareness and wouldn’t be able to see where they are the issue.,28
751,l3t5rao,theflyingnacho,1715575882.0,Your child is allowed to exist in public.,54
752,l3tyj3f,just-kath,1715596609.0,"It's true that some people are entitled and unaware of how to behave politely in public. It is also true that many people forget that they were children themselves, or raised children.. and that kids can sometimes get in the way, be loud or slow. They couldn't show grace to others under any circumstance. You keep on being a mom and don't feel guilty about being in a store for heavens sake",2
753,l3u8bgi,Charisma_Fairy813,1715602131.0,"It’s sad that this is the society our children are growing up in. They are children.. my god go around it’s not that big of an issue. 🤦🏼‍♀️ how are kids supposed to learn if the parents just keep them stuck up in the cart so that they never get in anyone’s way. 

I’ve got three kids and no they aren’t just running around wild in Costco but they had to learn somehow… and yeah a few times they may have been too slow or been in peoples way. I’ll gently correct them and let them know that they have to walk on the side not down the middle of the aisle. 

You are not doing anything wrong. Continue letting your child walk around because people can just get their panties out of a bunch and relax. Sorry for my rant! People are so self centred and think that what they have going on is the only thing that matters. Well newsflash the world doesn’t just belong to you so get used to Costco being busy and kids going shopping with their families.",0
754,l3u9zhm,Independent_Baby5835,1715602958.0,"Those people are the most annoying. They ditch their carts and run for the samples and I’m stuck not able to go anywhere until they return. Then they have the audacity to just stand there and eat the damn sample. I could care less about the samples unless my 5 year old was with me, but I certainly won’t ditch him and the cart to go grab a sample.",1
755,l3slwjr,NomadFeet,1715565935.0,I don't deal with those people and go park in the waaaay back of the parking lot because that's where there are trees. Actual Floridians know that  shady spot far away is superior than a close one in full sun.,50
756,l3srpx7,sffbfish,1715568515.0,It doesn't stop with just the cars. I've been in so many where people are just walking in the middle of the lane as if *they're cars* and give you the nastiest looks if you honk at them!,7
757,l3stcre,Karagee,1715569291.0,Yesterday I saw a guy and his wife loading their car while parked diagonally in the middle of an absolutely packed parking lot. Completely blocking the whole parking lane,3
758,l3sm9ne,Dreaunicorn,1715566093.0,"I absolutely hate people that do the blinker thing. I have a baby to unload, stroller to fold, then groceries. ",14
759,l3symli,conundrum-quantified,1715571917.0,Or walks slowly down the middle of the lane ignoring the fact that  is  intended for CARS!,2
760,l3sqhgw,Fancy_Cry_1152,1715567948.0,I was trying to unload my full cart and get my baby in his car seat by myself and this woman PARKS HER CAR IN THE MIDDLE OF THE AISLE to wait on my spot. I was so f-ing mad at her. It made me feel so rushed and pressured that I didn’t even buckle my baby!! I had to pull over and fix it.,4
761,l3t8ei4,yxwy,1715577491.0,I DON'T UNDERSTAND WHY ENTERING THE COSTCO PARKING LOT MAKES PEOPLE COMPLETELY LOSE ALL BRAIN ACTIVITY,1
762,l3tlyfg,Dancingskeletonman86,1715587116.0,Worse is when there is no one leaving but they sit there anyway and wait for someone to come out. Sometimes several minutes at a time and stalk people who are loading their groceries up. Even honking their horn or giving exaggerated hands in the air gestures at the person. Excuse me!? You are the one blocking everyone's way to that aisle and stalking people over a parking spot. Usually when there is ones in back further from store still available. Either go use those spots or at least try to not clog up entire parking lot aisles refusing to move until you some prey come out you can stalk for spot.,1
763,l3ubhyf,TehITGuy87,1715603677.0,"Omg so this isn’t just me who noticed the middle lane driving. Like wtf are you thinking? And they refuse to move or pretend they don’t see me. I live in the Denver area, so I’m worried about getting upset with someone cause they may pull a gun on me 🤣",1
764,l3tltt7,FreydNot,1715587014.0,And then somehow magically forget again that payment is required at checkout. Some people... Smh,2
765,l3sm3wt,AnthropomorphicSeer,1715566024.0,There may be something to this. The rudest people I have ever encountered were in Whole Foods.,20
766,l3sunuc,HoopsLaureate,1715569930.0,"I find way too many stop the second they walk into Costco. Like, why? At least pull over to the side with your cart. But the number of times I’ve run into people because they randomly decide to stop the second they enter Costco boggles my mind.",1
767,l3sjkqc,gigibuffoon,1715564912.0,Covid brought out the worst in a large part of our society,18
768,l3v9c8w,Hard-To_Read,1715616594.0,"*lose, although in that scenario it hardly matters",2
769,l3ttdp0,RoadDog14,1715592971.0,Same. Used to be nice and let people do it but now 6’6” me also just continues my trajectory.,4
770,l3v4u03,7Breakz,1715615022.0,Exactly my approach. All the while giving them the cop stare down. The stare generally works too,2
771,l3viukt,SwimmerIndividual510,1715619879.0,"Also, faux breaking wind via a whoopee cushion concealed under your purse is very surefire.",1
772,l3t7rvp,hgghgfhvf,1715577100.0,Just bellow it out the first time. They won’t hear the first two anyway so they’ll still think you just abruptly yelled at them with no warning. Might as well save yourself the trouble.,1
773,l3t9l6o,theevanillagorillaa,1715578249.0,"Thats why a simple you’re blocking the damn entire exit, please move.",1
